1,"",0,5,5,8,8,5,5,6,5,5,5,8,7,5,5,8,8,5,6,4,5,6,6,6,8,6,8,5,5,5,5,6,6,7,6,7,7,7,7,7,7,6,6,6,6,7,5,6,6,6,7,6,6,6,6,5,7,6,6,6,5,5,7,7,7,5,5,7,7,6,6,6,6,8,6,6,5,8,7,6,6,8,8,5,5,6,5,7,6,6,6,3,3,3,3,2,3,1,2,"","","1","",5,5,1,"The date was very smooth because she was very easy to talk to. She also seemed very smart, driven, and interesting which meant there was no lack of topics to discuss. I have to admit, however, I was somewhat turned away from my date partner due to her age. That being said this was very fun and I am definitely excited to potentially take part in more dates.","s","f24449149_f2496120","fall","f24449149","f2496120",5,8,5,5.5,5,7.5,5,8,5.5,4.5,6,7,7,5,5,6,6.5,7,7,7,6,6,6,6,6.5,6,6,6,6,5.5,6,7,5,7,6,6,7,5.5,7.5,6,8,5,5.5,6.5,6,5,7,6.5,7,8.5,6,6.5,7,6,4,4.5,6.5,6,1,4.5
0,"",0,6,5,6,6,5,6,6,5,6,7,7,6,5,6,7,6,5,5,5,5,6,5,5,5,6,6,5,5,7,6,8,7,7,7,6,6,7,7,6,5,7,7,8,6,6,6,6,8,5,6,8,6,4,4,6,6,5,5,6,6,6,6,6,6,5,5,7,7,5,6,7,6,7,7,6,6,7,7,5,5,6,6,4,4,6,6,5,5,6,6,4,1,4,3,3,3,1,2,"","","1","",5,5,1,"Benson seems nice, although he did hint that he was doing this study for one of his GE classes and that he was trying to just get it done. He seems to come from a nice family and we both have lived in three different continents. I think he is honestly more like friend material than anything else, but I would have to know him better. Conversation flowed relatively easily. ","r","f24877447_f24650829","fall","f24877447","f24650829",5.5,6,5.5,5.5,6.5,6.5,5.5,6.5,5,5,5.5,5,6,5,6.5,7.5,7,6,7,5.5,7,7,6,7,5.5,7,4,6,5,6,6,6,5,7,5.5,6.5,7,6,7,5,6,4,6,5,6,6.5,8,7.5,7.5,7.5,7.5,7.5,5.5,8,7.5,6.5,6,8.5,3.5,6.5
1,"",0,4,7,6,5,5,5,8,5,9,9,7,6,6,7,8,7,5,7,5,9,4,4,5,5,5,6,5,5,6,7,7,6,8,8,8,7,8,7,8,7,7,8,7,8,6,5,8,8,8,7,7,6,6,6,9,8,2,5,7,6,7,6,7,7,6,6,7,6,7,5,7,7,7,7,7,6,6,7,6,6,8,6,4,4,7,6,5,6,7,6,3,2,3,4,4,4,0,2,"","she was very sweet, but personally not my type","1","",3,3,1,"it was good, i felt like the conversations flowed really well and it was not awkward. she had a great personality and was pretty but personally not my type, i could possibly see us as friend though. i had a good time with her and it was good to get to know her. the date went pretty good in general.","r","f24650829_f24877447","fall","f24650829","f24877447",5.5,5.5,5,6.5,9,6.5,6.5,7.5,6,7,4,5,5.5,5,6.5,6.5,8,7.5,7.5,7.5,7.5,7.5,5.5,8,7.5,6.5,6,8.5,3.5,6.5,6.5,7,6,6.5,6,7,7,6.5,6.5,6,7,4,6.5,5.5,6.5,7,7,6,7,5,6.5,7.5,7,7,5.5,7,4,6,5,6
0,"",0,5,4,5,6,4,4,5,6,6,6,6,6,6,6,6,5,6,5,7,7,5,5,7,7,6,7,5,5,5,5,6,4,5,6,4,5,5,6,4,8,8,7,2,4,5,6,4,5,7,7,5,5,2,2,5,5,5,4,5,5,7,6,7,6,6,5,7,6,7,7,7,7,5,7,6,7,7,7,7,7,7,5,2,2,7,6,5,4,6,7,3,2,4,4,4,4,1,2,"","","1","",6,6,5,"it went well","s","f24744269_f2430128","fall","f24744269","f2430128",4.5,5.5,4,5.5,6,6,6,5.5,5.5,7,5,7,6.5,5,5,5,5.5,4.5,5.5,6,7.5,3,5.5,4.5,7,5,2,5,4.5,5,6.5,6.5,5.5,6.5,7,7,6,6.5,7,7,6,2,6.5,4.5,6.5,6,7.5,3,5.5,7,9,3.5,8,4,5.5,7,8.5,7.5,5,5
1,"",0,6,6,7,7,6,6,6,6,5,6,7,7,5,6,7,5,6,7,7,7,6,6,4,2,6,3,5,5,5,5,6,6,7,7,3,3,5,5,5,9,9,8,4,5,7,8,4,4,4,7,6,8,8,8,6,6,5,2,5,5,7,6,6,6,4,5,6,6,8,8,9,9,7,5,6,6,7,6,7,8,8,8,9,8,5,5,6,6,7,7,4,3,4,4,3,4,1,2,"","","1","",5,4,3,"Naomi was fun to talk with. She seems very nice and fun. I think she definitely has her priorities straight and she knows what she wants and doesn't want, which is a good trait. She seems like she has a supportive family.","s","f2430128_f24744269","fall","f2430128","f24744269",6,7,6,6,5.5,7,5.5,6,6.5,7,6,3,4.5,5,5,6,7,3,5,7,8.5,4.5,7.5,4,5.5,7,8,6,3.5,5,6.5,6,4.5,6,8,9,6,6,6.5,7.5,8,8.5,5,6,7,5,5.5,4.5,5.5,6,7.5,3,5.5,4.5,7,5,2,5,4.5,5
0,"",0,2,3,6,6,7,7,5,6,5,7,6,5,2,1,8,8,5,6,5,5,2,3,2,2,7,7,2,2,6,6,8,8,8,8,5,4,8,7,7,10,8,8,8,9,7,7,10,10,5,7,8,8,4,4,7,7,8,8,8,7,8,8,8,8,4,5,7,8,7,7,8,8,8,9,7,7,10,10,5,7,8,8,3,8,7,7,8,8,8,7,2,2,2,2,2,2,0,2,"","Due to the fact we have different personalities ","1","",2,2,5,"I think he was very shy which was hard to make conversation with him. ","s","f24684389_f24268077","fall","f24684389","f24268077",2.5,6,7,5.5,6,5.5,1.5,8,5.5,5,2.5,2,7,2,6,8,8,4.5,7.5,8.5,8,8.5,7,10,6,8,4,7,8,7.5,8,8,4.5,7.5,7,8,8.5,7,10,6,8,5.5,7,8,7.5,5,5,6,4.5,6,5.5,4,5,5,5.5,5,0,5,5,5.5
1,"",0,5,5,5,6,5,6,6,6,6,6,5,6,5,5,6,5,5,6,5,5,6,6,5,5,5,5,5,5,6,5,5,5,6,5,6,6,5,6,5,7,6,6,4,5,5,5,5,5,5,5,5,5,0,0,5,5,5,5,5,5,6,5,6,6,6,6,6,6,5,6,6,6,5,5,6,6,5,6,5,5,7,5,5,5,5,5,5,5,6,5,3,3,3,2,2,2,0,2,"","I don't know, she seemed like a nice person. I just don't really feel the need to do so.","1","",4,4,1,"I thought that my date partner was a nice person to talk to. We seemed to get along somewhat well and had a few thing in common. She seemed to be quite friendly and more mature. Overall the date was fine.

Just as a side note about my previous date partner since I didn't really explain why I didn't like her last time:
She seemed to have a bit of an ego that made her somewhat unpleasant to talk to and in the conversation I didn't really feel like I was given the space to speak up at all.","s","f24268077_f24684389","fall","f24268077","f24684389",5,5.5,5.5,6,6,5.5,5,5.5,5.5,5,6,5,5,5,5.5,5,5.5,6,5.5,6,6,4.5,5,5,5,5,0,5,5,5,5.5,6,6,6,5.5,6,5,6,5.5,5,6,5,5,5,5.5,7.5,8,3.5,7,8,7,8,7,8.5,5.5,8,4,7,7.5,6.5
1,"",0,5,6,6,5,6,5,6,5,5,5,6,6,6,7,5,5,6,6,6,5,5,6,3,3,5,6,7,5,5,5,6,7,6,6,5,5,6,7,7,7,6,6,6,6,5,6,6,7,7,6,6,6,3,2,7,6,7,7,5,4,5,7,6,6,5,5,5,5,5,5,6,6,5,5,5,5,5,5,6,6,5,6,4,3,5,5,6,6,5,5,4,5,5,4,4,3,1,2,"","","1","",6,6,3,"I had a great time the whole time. We talked about our interests and things we liked. We shared a lot of interests between us. I would love to go on another date.","s","f24440834_f24239318","fall","f24440834","f24239318",5.5,5.5,5.5,5.5,5,6,6.5,5,6,5.5,5.5,3,5.5,6,5,6.5,6,5,6.5,7,6,6,5.5,6.5,6.5,6,2.5,6.5,7,4.5,6,6,5,5,5,6,5,5,5,6,5.5,3.5,5,6,5,6.5,2.5,5,3.5,9,6,9.5,6.5,6.5,5.5,5.5,4.5,7,3.5,5.5
0,"",0,0,2,4,3,2,3,7,7,5,6,8,8,5,4,8,10,5,7,5,5,5,5,2,2,6,6,5,2,5,5,9,3,3,2,0,9,3,3,10,9,5,6,10,10,6,8,5,2,4,4,7,6,2,5,7,8,5,7,4,4,9,8,8,7,1,7,4,4,7,5,6,6,10,8,6,6,9,6,6,8,10,8,5,3,8,8,7,8,6,6,1,1,1,2,2,3,0,2,"","He was nice, but we don't have really anything in common in terms of hobbies and I couldn't imagine interacting any further with this person","1","",2,3,3,"My date seemed like a nice guy, but doesn't really go out that much. He seems a bit shy and not outgoing. In addition, he seems socially awkward but is trying his best. I don't really have any opinions on my date but I wish him the best  in his endeavors.","s","f24239318_f24440834","fall","f24239318","f24440834",1,3.5,2.5,7,5.5,8,4.5,9,6,5,5,2,6,3.5,5,6,2.5,4.5,3,9.5,5.5,10,7,3.5,4,6.5,3.5,7.5,6,4,8.5,7.5,4,4,6,6,9,6,7.5,7,9,4,8,7.5,6,6,5,5,6,6,5.5,5,5,6,6,5.5,3,5.5,6,5
1,"",0,6,5,7,8,5,6,7,7,7,7,7,6,7,7,7,7,5,7,5,6,7,7,5,5,5,7,5,5,7,7,5,7,7,7,4,5,5,5,5,7,6,7,7,6,9,7,6,7,6,6,5,5,0,0,8,8,5,7,6,6,7,8,8,8,7,8,7,8,9,8,8,8,8,8,9,8,9,10,7,9,9,8,0,0,9,8,8,7,8,7,4,2,6,3,1,4,1,2,"","","1","",5,5,1,"We did not use the cards at all, just tried making our own question topics. Overall the conversations went smoothly and there was a good back and forth rallying of talking. The date partner was enjoyable to talk to and had similar humor to myself. It was a bit awkward at first but we warmed up after the initial introductions","r","f24781167_f24435518","fall","f24781167","f24435518",5.5,7.5,5.5,7,7,6.5,7,7,6,5.5,7,5,6,5,7,6,7,4.5,5,6,6.5,6.5,8,6.5,6,5,0,8,6,6,7.5,8,7.5,7.5,8.5,8,8,8.5,9.5,8,8.5,0,8.5,7.5,7.5,7,9,7,8.5,4.5,8,8.5,6.5,9,7,5,1,8.5,5,8
0,"",1,4,3,8,8,4,5,8,8,7,8,6,5,7,5,7,6,7,8,7,5,5,5,3,4,8,8,3,2,7,7,8,6,9,9,7,7,9,8,4,5,8,8,9,8,6,7,9,9,5,9,5,5,1,1,9,8,6,4,8,8,8,7,9,9,6,7,7,6,6,5,8,8,7,8,9,9,9,9,5,7,7,8,2,1,9,8,7,7,9,8,1,1,1,1,1,4,1,2,"","","1","",2,2,1,"My date was definitely easy to talk to though I did have to prompt most conversation. It was nice just to chat with someone I normally probably wouldn't have crossed paths with outside of this scenario. The person is not physically or personality wise who I would be attracted to or see myself in a long term relationship with, but I can see us being friends. I liked that we could talk about anything and the person was considerate about prying too much. Ultimately, this was a fun experience I would do again.","r","f24435518_f24781167","fall","f24435518","f24781167",3.5,8,4.5,8,7.5,5.5,6,6.5,7.5,6,5,3.5,8,2.5,7,7,9,7,8.5,4.5,8,8.5,6.5,9,7,5,1,8.5,5,8,7.5,9,6.5,6.5,5.5,8,7.5,9,9,6,7.5,1.5,8.5,7,8.5,6.5,7.5,4,4,5,6,6.5,8,6,6,5,0,7.5,6,6
1,"",0,5,6,5,5,9,7,3,3,4,5,6,5,6,5,6,6,7,4,6,4,7,6,5,6,5,6,6,6,5,4,5,3,9,5,3,2,8,9,5,5,7,8,7,5,5,5,5,4,4,4,5,7,7,7,5,8,5,6,6,5,5,3,7,7,5,6,9,8,5,5,6,6,8,4,6,5,5,5,5,5,5,5,6,6,6,6,5,6,5,7,5,4,5,3,3,3,1,2,"","","1","",3,5,7,"It went well. I just dont feel as though she was as attracted to me as I was to her. Nevertheless it was a good date and she was a really nice person. I liked that she shared as much as she did about her life. ","s","f24197293_f24267054","fall","f24197293","f24267054",5.5,5,8,3,4.5,5.5,5.5,6,5.5,5,6.5,5.5,5.5,6,4.5,4,7,2.5,8.5,5,7.5,6,5,4.5,4,6,7,6.5,5.5,5.5,4,7,5.5,8.5,5,6,6,5.5,5,5,5,6,6,5.5,6,6,7,6.5,6,6,6,6,5.5,6,6.5,6.5,7.5,5.5,5,6
0,"",0,6,5,5,5,4,4,8,8,6,6,6,6,5,4,6,5,6,6,5,5,5,5,6,6,5,6,5,5,5,5,6,6,7,6,6,6,6,6,5,5,6,5,6,6,6,5,6,5,6,6,6,6,8,7,5,5,5,5,5,4,8,6,8,9,5,8,6,7,6,7,7,7,7,8,6,6,8,8,8,9,9,9,8,8,9,9,10,6,8,8,2,2,2,4,3,4,0,2,"","He was younger and I want someone whos older than me. He was kinda quiet and introverted. Im also introverted and I just feel like I need someone to be more extroverted. He seems really sweet but he also seemed kinda boring. He also just wasnt my type. I feel like we could be great friends but Im just not romantically interested. ","1","",3,3,6,"During the date we just talked mostly using the cards. Conversation seemed a little less natural than my previous date. We sat down on the UCEN lawn and just talked for the whole date. The cards were very useful as conversation didnt click right away. I felt like I was talking most of the time and I was actively paying  attention to when I would ask my date partner questions. It wasnt awkward though. The cards definitely made us talk about deeper topics. ","s","f24267054_f24197293","fall","f24267054","f24197293",5.5,5,4,8,6,6,4.5,5.5,6,5,5,6,5.5,5,5,6,6.5,6,6,5,5.5,6,5.5,5.5,6,6,7.5,5,5,4.5,7,8.5,6.5,6.5,6.5,7,7.5,6,8,8.5,9,8,9,8,8,4,7,2.5,8.5,5,7.5,6,5,4.5,4,6,7,6.5,5.5,5.5
0,"",0,7,5,9,9,6,6,8,9,9,9,8,9,8,7,9,9,8,7,10,7,8,9,7,5,9,10,8,6,8,8,7,9,9,7,6,5,7,8,10,10,7,7,7,6,9,8,7,9,8,8,7,7,6,4,4,5,9,7,9,10,8,8,9,9,6,7,9,9,8,8,7,7,8,7,8,9,8,10,8,8,7,7,5,6,9,6,7,7,9,8,5,5,6,4,4,4,1,2,"","","1","",6,7,6,"Specifically for the cards, they were really good questions. We both had to stop and think about a couple of the keywords used. The religion card got us on a pretty good tangent about karma etc which was a really interesting conversation to have. I appreciated that the cards weren't age/major/basic information based because we were both able to incorporate small tidbits of our lives into the answers. It was a little too short, I think we had 2ish cards left, but otherwise a very chill interaction with not too much pressure put on either of us. ","r","f24324705_f24443181","winter","f24324705","f24443181",6,9,6,8.5,9,8.5,7.5,9,7.5,8.5,8.5,6,9.5,7,8,8,8,5.5,7.5,10,7,6.5,8.5,8,8,7,5,4.5,8,9.5,8,9,6.5,9,8,7,7.5,8.5,9,8,7,5.5,7.5,7,8.5,7.5,10,6.5,10,10,8.5,7.5,7.5,9.5,8.5,8,6.5,7,9.5,8.5
1,"",0,6,7,8,9,7,7,10,10,8,9,9,8,9,8,10,8,10,9,9,8,9,9,8,8,9,5,8,5,10,10,8,7,10,10,6,7,10,10,10,10,9,8,7,8,8,7,10,9,9,8,8,8,7,6,8,6,10,9,9,8,7,7,8,10,6,6,8,8,9,7,7,9,8,7,7,7,9,9,10,7,8,9,6,6,5,5,9,9,8,7,6,5,7,4,4,5,1,2,"","","1","",6,6,6,"The date was fun, Kelly was open minded and interesting in many aspects of what we talked about. I loved that she has a dog that she loves and I enjoyed hearing her perspectives on the things we talked about such as traits core beliefs.","r","f24443181_f24324705","winter","f24443181","f24324705",6.5,8.5,7,10,8.5,8.5,8.5,9,9.5,8.5,9,8,7,6.5,10,7.5,10,6.5,10,10,8.5,7.5,7.5,9.5,8.5,8,6.5,7,9.5,8.5,7,9,6,8,8,8,7.5,7,9,8.5,8.5,6,5,9,7.5,8,8,5.5,7.5,10,7,6.5,8.5,8,8,7,5,4.5,8,9.5
0,"",0,5,2,7,3,3,3,7,8,10,7,5,3,7,2,6,7,5,5,4,5,2,3,2,5,5,6,2,8,5,7,10,9,8,8,5,5,8,9,10,9,9,8,9,7,4,8,10,10,10,10,10,9,5,5,8,8,10,7,8,8,10,6,8,7,5,3,5,6,10,10,10,10,7,10,9,9,10,10,10,9,10,10,5,5,8,10,10,5,7,8,1,1,1,4,1,3,0,2,"","I have no interest in them, and I cannot see myself being acquainted with them","1","",1,5,7,"I felt that there were a lot of awkward moments in the conversation. We almost finished answering all of the cards, they were what helped lead the conversation. I have had my fair share of meeting people and going on dates, but this one felt awkward. I think we have little in common, which isn't a bad thing but I can't see us being friends or acquainted in any way. ","s","f24675030_f24734101","winter","f24675030","f24734101",3.5,5,3,7.5,8.5,4,4.5,6.5,5,4.5,2.5,3.5,5.5,5,6,9.5,8,5,8.5,9.5,8.5,8,6,10,10,9.5,5,8,8.5,8,8,7.5,4,5.5,10,10,8.5,9,10,9.5,10,5,9,7.5,7.5,7,6,6,10,10,10,7,9,9,8.5,7.5,2,8,5,8
1,"",0,4,5,8,8,5,6,7,7,9,9,7,7,5,5,7,7,7,7,10,9,7,6,5,5,5,6,4,3,6,6,7,7,7,5,5,7,10,10,10,10,10,10,7,7,9,9,9,9,8,9,8,7,2,2,8,8,5,5,8,8,8,7,7,6,6,7,9,9,7,8,8,8,9,8,8,9,9,10,7,7,8,7,2,2,7,6,5,6,8,7,2,1,2,2,1,1,0,2,"","I chose not to exchange contact info because I felt like we were leading different lives and had different interests although she seemed like a nice person. I considered sharing contact info as more becoming friends with her but I felt like we were pretty different and also I'm not that good at technology lol.","1","",2,3,6,"The date was fun but it felt very surface level. I tried to learn more and go beyond the cards but we kept going back to the cards during the date. Also, I felt like we closed off to each other and weren't fully engaged in the concept of actually dating. Although it was fun meeting someone new and it was very great in that regard, the actual ""romantic"" dating aspect didn't seem to go anywhere. I would love to do this again as it is amazing for meeting new people.","s","f24734101_f24675030","winter","f24734101","f24675030",4.5,8,5.5,7,9,7,5,7,7,9.5,6.5,5,5.5,3.5,6,7,6,6,10,10,10,7,9,9,8.5,7.5,2,8,5,8,7.5,6.5,6.5,9,7.5,8,8.5,8.5,9.5,7,7.5,2,6.5,5.5,7.5,9.5,8,5,8.5,9.5,8.5,8,6,10,10,9.5,5,8,8.5,8
1,"",1,7,5,7,7,8,7,8,7,4,6,5,5,5,6,7,9,7,9,6,5,5,5,4,4,5,8,4,5,5,5,7,7,7,8,6,8,6,6,8,7,7,6,6,7,7,6,5,6,5,5,5,5,6,7,5,9,6,6,7,6,6,6,7,7,6,6,9,8,5,5,5,5,7,6,7,7,7,6,5,5,6,5,5,5,5,5,6,6,5,5,4,1,4,2,2,3,1,2,"","","1","",6,6,5,"I thought it went well. I could definitely see me and my date partner becoming friends.  ","r","f24494329_f24809990","winter","f24494329","f24809990",6,7,7.5,7.5,5,5,5.5,8,8,5.5,5,4,6.5,4.5,5,7,7.5,7,6,7.5,6.5,6.5,6.5,5.5,5,5,6.5,7,6,6.5,6,7,6,8.5,5,5,6.5,7,6.5,5,5.5,5,5,6,5,6.5,6,7,9,3.5,5,6.5,6,8.5,6.5,6.5,2.5,6.5,4,5
0,"",2,6,6,6,6,3,4,8,8,8,7,6,6,5,5,7,6,8,7,6,6,6,5,2,2,6,7,5,5,5,5,7,6,6,6,7,7,9,9,3,4,5,5,6,7,6,6,9,8,5,8,6,7,2,3,6,7,5,3,5,5,5,5,6,6,5,5,8,8,5,6,6,6,6,6,7,7,9,7,5,8,6,6,5,4,6,6,5,3,5,5,3,1,4,2,1,3,1,2,"","","1","",5,5,6,"","r","f24809990_f24494329","winter","f24809990","f24494329",6,6,3.5,8,7.5,6,5,6.5,7.5,6,5.5,2,6.5,5,5,6.5,6,7,9,3.5,5,6.5,6,8.5,6.5,6.5,2.5,6.5,4,5,5,6,5,8,5.5,6,6,7,8,6.5,6,4.5,6,4,5,7,7.5,7,6,7.5,6.5,6.5,6.5,5.5,5,5,6.5,7,6,6.5
1,"",0,5,5,8,8,6,7,8,8,10,10,6,6,8,7,7,7,5,7,5,5,5,5,0,0,5,5,5,2,6,6,5,5,10,10,5,5,9,9,10,10,8,7,10,10,5,7,6,7,5,5,5,6,2,0,5,5,5,5,7,6,5,5,7,7,5,5,6,8,10,10,6,6,6,5,5,5,5,6,5,5,5,5,5,5,5,5,5,5,5,5,4,1,4,1,1,2,1,2,"","","1","",4,5,4,"She seemed really nice. It was nice meeting someone new and talking to her. We talked about classes because we are both sociology majors and first years. We talked with the cards and talked about our interests, hobbies, and our hometowns.","r","f24723820_f24958454","winter","f24723820","f24958454",5,8,6.5,8,10,6,7.5,7,6,5,5,0,5,3.5,6,5,10,5,9,10,7.5,10,6,6.5,5,5.5,1,5,5,6.5,5,7,5,7,10,6,5.5,5,5.5,5,5,5,5,5,5,6,6.5,7,7,10,5,8.5,5.5,9,6.5,5.5,0.5,5,6,6
0,"",0,4,3,6,6,3,5,4,3,8,10,5,5,5,4,6,6,5,8,7,6,7,5,0,0,5,6,5,5,7,5,5,7,7,6,6,8,7,7,10,10,5,5,9,8,6,5,8,10,7,6,6,5,0,1,5,5,6,6,6,6,6,7,8,7,6,6,8,8,10,10,7,7,10,9,6,7,8,10,7,10,7,7,0,1,7,6,8,7,8,6,2,1,2,2,2,3,0,2,"","They were nice, but I felt like I was carrying the conversation.","1","",3,5,4,"The date went well. Although we were similar on paper, we had pretty different personalities. For example, we had the same major and seemed to share similar ideas, but whenever I made a joke he did not laugh. I think that personality has a large impact.
","r","f24958454_f24723820","winter","f24958454","f24723820",3.5,6,4,3.5,9,5,4.5,6,6.5,6.5,6,0,5.5,5,6,6,6.5,7,7,10,5,8.5,5.5,9,6.5,5.5,0.5,5,6,6,6.5,7.5,6,8,10,7,9.5,6.5,9,8.5,7,0.5,6.5,7.5,7,5,10,5,9,10,7.5,10,6,6.5,5,5.5,1,5,5,6.5
1,"",0,6,5,7,6,8,8,7,7,6,7,7,7,6,6,7,7,7,7,5,6,8,7,5,5,6,7,5,5,6,6,6,7,7,8,6,6,7,7,7,7,7,6,8,6,7,7,7,6,7,7,6,6,5,5,7,7,5,7,6,6,6,7,7,7,6,6,6,7,6,6,6,6,6,6,6,6,7,7,7,7,6,6,5,5,5,6,5,6,5,5,5,5,6,4,4,4,1,2,"","","1","",5,4,2,"It was really nice getting to know her! Seems like a very nice person :)","r","f24118531_f24994013","winter","f24118531","f24994013",5.5,6.5,8,7,6.5,7,6,7,7,5.5,7.5,5,6.5,5,6,6.5,7.5,6,7,7,6.5,7,7,6.5,7,6,5,7,6,6,6.5,7,6,6.5,6,6,6,6,7,7,6,5,5.5,5.5,5,6,6,5,7,7,6,3.5,5,6,5,5.5,0,4.5,4,5.5
0,"",0,5,5,5,5,5,5,6,6,5,6,6,5,5,4,6,5,5,6,5,5,5,5,4,3,5,6,5,5,5,5,5,7,6,6,5,5,7,7,7,7,6,6,4,3,6,4,5,7,6,4,5,6,0,0,4,5,3,5,6,5,5,6,7,6,6,8,6,6,6,7,7,6,6,6,6,7,6,7,6,7,6,6,0,0,7,7,7,5,6,6,4,3,4,3,3,4,1,2,"","","1","",5,5,4,"It was nice!","r","f24994013_f24118531","winter","f24994013","f24118531",5,5,5,6,5.5,5.5,4.5,5.5,5.5,5,5,3.5,5.5,5,5,6,6,5,7,7,6,3.5,5,6,5,5.5,0,4.5,4,5.5,5.5,6.5,7,6,6.5,6.5,6,6.5,6.5,6.5,6,0,7,6,6,6.5,7.5,6,7,7,6.5,7,7,6.5,7,6,5,7,6,6
0,"",0,4,5,4,6,5,6,6,7,6,5,6,6,8,8,7,7,5,5,5,5,7,6,5,5,6,6,5,5,7,6,6,6,5,4,7,6,5,4,5,5,3,5,7,6,5,5,6,5,7,5,5,4,4,4,5,5,5,6,5,5,6,6,6,6,7,7,6,6,6,7,7,6,7,5,6,7,8,7,7,6,7,6,5,5,6,6,7,6,7,6,3,3,2,2,2,2,1,2,"","","1","",5,5,4,"I got along really well with my date! We had a lot of common interests and sense of humor, and I totally see myself hanging out with him as friends, but maybe not as a romantic partner. I believed it wasn't really his qualities that made me hesitant about dating him, but more of a sense that my qualities and goals wouldn't really match with his. I think it also helped that we both the same year, so it wasn't as nervewracking as I thought it would've been. ","r","f24559078_f2479457","winter","f24559078","f2479457",4.5,5,5.5,6.5,5.5,6,8,7,5,5,6.5,5,6,5,6.5,6,4.5,6.5,4.5,5,4,6.5,5,5.5,6,4.5,4,5,5.5,5,6,6,7,6,6.5,6.5,6,6.5,7.5,6.5,6.5,5,6,6.5,6.5,6,7,6,6,7,6,7.5,6.5,6,5,5.5,0,7,5,6
1,"",0,5,6,7,7,8,7,6,7,7,6,6,6,8,8,7,7,6,7,5,5,7,7,5,4,5,7,5,5,6,6,6,6,7,7,6,6,6,6,7,7,6,6,8,7,7,6,6,6,5,5,5,6,0,0,6,8,5,5,6,6,6,6,6,6,6,6,7,6,5,5,6,6,8,8,7,7,6,6,5,5,6,5,3,2,7,6,5,5,5,6,5,3,5,4,2,4,1,2,"","","1","",6,6,4,"I thought that the date went well. We initially stuck to cards at first but then started to go off to other topics outside of the cards. We bounced off of each other near the end and the conversation just started to flow naturally. It was a bit awkward at first (it is a blind date after all) but it was fun.","r","f2479457_f24559078","winter","f2479457","f24559078",5.5,7,7.5,6.5,6.5,6,8,7,6.5,5,7,4.5,6,5,6,6,7,6,6,7,6,7.5,6.5,6,5,5.5,0,7,5,6,6,6,6,6.5,5,6,8,7,6,5,5.5,2.5,6.5,5,5.5,6,4.5,6.5,4.5,5,4,6.5,5,5.5,6,4.5,4,5,5.5,5
0,"",0,5,7,5,5,3,4,6,6,7,6,5,5,6,4,6,5,6,5,6,5,5,7,5,0,5,6,3,5,4,5,8,8,9,9,8,8,7,8,6,8,6,5,7,6,7,7,7,7,8,8,7,8,7,1,5,9,9,10,6,6,9,8,10,10,7,7,8,8,5,5,6,6,7,7,7,8,8,8,8,8,8,7,1,1,9,9,10,9,5,5,2,1,2,4,4,5,0,2,"","He did not bring it up until we were already walking back to take the survey, so we didn't really have time/a conversation about it","1","",2,3,4,"I definitely enjoyed the conversation and getting to know Daniel as a friend. I definitely think that he is too young for me, with him being 19 years old (a second year) and me being 20(third year). This definitely wouldn't be much of a difference for other people but I think he has a lot of maturing to do before I'd really consider him as a partner. I kept just thinking of him as really young. I do think that our conversation went well and we get along, but he is not someone i'd ever pursue in a natural setting. Also, he seemed pretty nervous and it made him seem not very confident... ","s","f24627858_f24976312","winter","f24627858","f24976312",6,5,3.5,6,6.5,5,5,5.5,5.5,5.5,6,2.5,5.5,4,4.5,8,9,8,7.5,7,5.5,6.5,7,7,8,7.5,4,7,9.5,6,8.5,10,7,8,5,6,7,7.5,8,8,7.5,1,9,9.5,5,6.5,7,7,6.5,7,5,8,8,6,7,5.5,6,6,5.5,7
1,"",0,6,5,6,5,9,8,7,6,7,6,6,5,6,6,7,7,6,7,7,7,8,7,5,5,5,5,7,5,7,6,8,5,8,6,6,8,6,7,7,7,5,5,8,8,9,7,6,6,7,7,6,5,6,6,5,7,5,6,7,7,7,6,7,6,7,8,6,6,7,7,5,5,8,7,8,7,6,7,7,7,7,7,6,6,5,5,7,7,7,5,6,5,7,4,3,5,1,2,"","","1","",5,4,4,"It was very pleasant, I think we connected well. She is a very deep thinker and I really appreciate that. Even though I think I am a deep thinker too, I don't think I quite matched her in our conversation. I think we had more things that we could have talked about, and I bet I could listen to her talk a while.","s","f24976312_f24627858","winter","f24976312","f24627858",5.5,5.5,8.5,6.5,6.5,5.5,6,7,6.5,7,7.5,5,5,6,6.5,6.5,7,7,6.5,7,5,8,8,6,7,5.5,6,6,5.5,7,6.5,6.5,7.5,6,7,5,7.5,7.5,6.5,7,7,6,5,7,6,8,9,8,7.5,7,5.5,6.5,7,7,8,7.5,4,7,9.5,6
1,"",0,4,4,4,7,4,5,6,6,4,4,7,5,4,5,5,4,6,4,7,4,6,4,4,4,4,4,5,4,5,5,5,7,5,6,3,7,8,7,6,4,5,4,3,8,8,6,7,8,6,6,4,3,5,2,5,5,5,3,8,8,6,5,6,6,4,3,7,7,7,3,6,5,7,5,7,6,6,7,6,6,5,7,5,5,6,6,4,5,7,6,3,3,3,2,2,2,1,2,"","","1","",5,5,3,"It was well designed date study to learn about other people, and I think that more people could be inclined to do this, and find completely different people. I like how the cards are their to build off on and even the fact that they were some deep questions, made us start a conversation off that. ","r","f24526295_f24814274","winter","f24526295","f24814274",4,5.5,4.5,6,4,6,4.5,4.5,5,5.5,5,4,4,4.5,5,6,5.5,5,7.5,5,4.5,5.5,7,7.5,6,3.5,3.5,5,4,8,5.5,6,3.5,7,5,5.5,6,6.5,6.5,6,6,5,6,4.5,6.5,7,7.5,8,9,9,8.5,9,8.5,8,7,8,0,6.5,6,8.5
0,"",1,5,5,7,7,6,5,7,7,6,5,5,6,7,6,8,8,5,7,6,5,5,4,5,5,5,7,5,5,7,5,7,7,8,7,8,8,9,9,9,9,8,9,10,8,8,9,8,8,7,7,8,8,0,0,8,5,7,5,9,8,7,6,9,8,8,8,9,9,7,8,8,8,9,9,8,9,8,9,9,8,8,8,1,1,8,9,7,5,8,8,2,1,2,4,3,4,0,2,"","very friendly, but not really interested in dating.
causally seeing someone else ","1","",5,4,3,"good friendly conversation","r","f24814274_f24526295","winter","f24814274","f24526295",5,7,5.5,7,5.5,5.5,6.5,8,6,5.5,4.5,5,6,5,6,7,7.5,8,9,9,8.5,9,8.5,8,7,8,0,6.5,6,8.5,6.5,8.5,8,9,7.5,8,9,8.5,8.5,8.5,8,1,8.5,6,8,6,5.5,5,7.5,5,4.5,5.5,7,7.5,6,3.5,3.5,5,4,8
1,"",0,4,5,6,7,6,7,8,7,10,10,7,6,8,6,7,7,8,7,8,8,5,7,2,3,6,7,5,5,5,5,5,7,5,3,5,4,8,7,7,6,6,5,8,6,7,7,7,9,8,6,6,6,3,3,3,8,5,10,5,5,7,8,6,6,5,5,6,7,9,10,7,6,5,6,7,7,8,8,7,8,6,7,6,4,5,5,8,8,6,5,4,5,4,3,1,2,1,2,"","","1","",5,5,7,"I think was laid back and relaxed. I enjoyed my time talking to Abby and I found her to be a well rounded person. It was a fun conversation.","s","f24361844_f24909969","winter","f24361844","f24909969",4.5,6.5,6.5,7.5,10,6.5,7,7,7.5,8,6,2.5,6.5,5,5,6,4,4.5,7.5,6.5,5.5,7,7,8,7,6,3,5.5,7.5,5,7.5,6,5,6.5,9.5,6.5,5.5,7,8,7.5,6.5,5,5,8,5.5,7.5,5.5,5.5,6,9,5,7,5,8.5,7.5,6.5,0.5,5,4.5,6
0,"",0,3,2,6,6,4,4,5,5,4,5,5,5,7,5,6,6,6,6,7,7,4,4,6,5,6,7,3,2,6,5,7,8,6,5,5,6,6,6,9,9,5,5,8,6,5,5,8,9,8,7,7,6,0,1,5,5,4,5,6,6,8,8,6,6,5,5,6,6,7,7,5,5,8,7,6,6,8,6,8,6,8,7,1,2,7,7,7,5,6,5,1,1,2,4,3,4,0,2,"","I am just not interested in him like that. I had a good time talking to him and getting to know him however I am not interested in anything romantic with him. ","1","",3,5,7,"It honestly felt less like a date and more like a conversation getting to know someone. Obviously because we were using the cards the conversation went deeper than it normally would so it did feel different in that sense but overall it was nice to talk to someone new. Answering the cards made me realize things about myself and what I look for in a partner and that was helpful just in general to know. ","s","f24909969_f24361844","winter","f24909969","f24361844",2.5,6,4,5,4.5,5,6,6,6,7,4,5.5,6.5,2.5,5.5,7.5,5.5,5.5,6,9,5,7,5,8.5,7.5,6.5,0.5,5,4.5,6,8,6,5,6,7,5,7.5,6,7,7,7.5,1.5,7,6,5.5,6,4,4.5,7.5,6.5,5.5,7,7,8,7,6,3,5.5,7.5,5
1,"",0,8,5,8,9,9,8,4,3,4,6,3,2,10,9,8,7,8,9,7,7,0,0,0,0,5,9,0,6,7,7,9,10,7,8,4,6,7,8,5,6,7,7,9,9,8,8,3,9,7,7,8,8,0,0,7,7,8,8,8,8,9,10,8,8,7,6,7,8,6,7,8,7,9,7,8,8,7,8,6,7,10,10,0,0,9,9,8,8,9,9,1,1,1,5,4,5,0,2,"","Didn't come up","1","",3,5,4,"She was a very nice person. I found it easy to talk to her and wasn't nervous at all. I just wasn't attracted to her. Lovely person though!","r","f24425885_f24308524","winter","f24425885","f24308524",6.5,8.5,8.5,3.5,5,2.5,9.5,7.5,8.5,7,0,0,7,3,7,9.5,7.5,5,7.5,5.5,7,9,8,6,7,8,0,7,8,8,9.5,8,6.5,7.5,6.5,7.5,8,8,7.5,6.5,10,0,9,8,9,5.5,8.5,7.5,5,9.5,5,8.5,6.5,6,9,5,0,6,5,7.5
0,"",0,5,5,7,7,8,7,9,9,5,5,6,7,5,5,8,8,6,8,6,6,7,6,0,0,5,7,5,5,5,6,6,5,9,8,7,8,5,5,9,10,5,5,10,7,6,7,7,5,10,8,5,5,0,0,5,7,5,5,8,7,7,5,8,5,5,6,5,5,8,5,6,6,8,6,7,7,7,7,6,7,6,6,0,0,5,5,5,5,7,6,5,4,5,4,4,4,1,2,"","","1","",6,6,5,"","r","f24308524_f24425885","winter","f24308524","f24425885",5,7,7.5,9,5,6.5,5,8,7,6,6.5,0,6,5,5.5,5.5,8.5,7.5,5,9.5,5,8.5,6.5,6,9,5,0,6,5,7.5,6,6.5,5.5,5,6.5,6,7,7,7,6.5,6,0,5,5,6.5,9.5,7.5,5,7.5,5.5,7,9,8,6,7,8,0,7,8,8
