0,"",0,2,3,5,4,6,6,4,4,3,4,5,5,1,3,6,5,4,3,3,2,3,3,4,2,5,5,3,3,3,3,6,5,5,5,3,4,5,5,6,7,5,5,7,7,5,5,5,6,7,6,5,5,0,0,4,4,5,5,6,6,6,5,5,5,5,5,5,5,6,5,5,5,6,7,5,5,6,6,6,6,6,6,0,0,5,5,5,5,5,5,1,1,1,2,2,1,0,2,"","We did not really have anything in common and our personalities are completely different. ","1","",2,2,5,"Conversation felt forced and boring. I kept wondering how much time was left so I could leave. The guy was pretty fixated with the cards and whenever I tried to bring up something else he would have a dry response and then fill out another card. It was awkward. ","r","f24699172_f24595538","fall","f24699172","f24595538",2.5,4.5,6,4,3.5,5,2,5.5,3.5,2.5,3,3,5,3,3,5.5,5,3.5,5,6.5,5,7,5,5.5,6.5,5,0,4,5,6,5.5,5,5,5,5.5,5,6.5,5,6,6,6,0,5,5,5,3,7,6.5,7.5,7,5,5,5,6.5,3,4.5,0,5,2,5
1,"",0,4,3,6,6,6,5,6,6,7,8,8,8,6,5,6,6,5,6,9,7,6,7,5,5,7,7,6,4,5,5,6,6,8,7,3,3,5,6,5,9,9,9,3,4,9,7,3,5,4,7,6,8,9,8,7,8,5,5,5,5,6,5,7,7,5,5,5,6,7,8,10,9,7,5,5,7,5,7,7,9,8,8,8,8,5,5,5,6,5,6,4,4,6,3,3,3,1,2,"","","1","",6,6,4,"The date I feel went relatively smoothly. We were able to have good conversations and discovered some shared interests. I wouldn't say there was a spark but I definitely enjoyed talking to her. I'd be interested in getting to know her more and seeing her again.","r","f2430128_f24225857","fall","f2430128","f24225857",3.5,6,5.5,6,7.5,8,5.5,6,5.5,8,6.5,5,7,5,5,6,7.5,3,5.5,7,9,3.5,8,4,5.5,7,8.5,7.5,5,5,5.5,7,5,5.5,7.5,9.5,6,6,6,8,8,8,5,5.5,5.5,5.5,8,5.5,6,8,8,7,5,6.5,8.5,5.5,6,5.5,5,6
0,"",0,6,4,8,6,4,3,6,6,6,6,8,7,5,7,6,7,5,6,6,6,7,7,6,7,9,8,5,5,6,6,7,6,8,7,7,5,NA,7,7,7,8,8,8,7,6,7,5,8,9,8,7,7,7,6,6,7,5,5,6,7,7,6,8,7,5,5,6,6,7,6,9,9,8,8,7,7,5,7,7,7,7,8,7,7,9,8,6,6,7,8,4,3,3,3,3,3,1,1,"7606890263","","1","",5,5,4,"It was very fun. I liked getting to know him and hearing about his life. I love talking to people so it was a great time. ","r","f24225857_f2430128","fall","f24225857","f2430128",5,7,3.5,6,6,7.5,6,6.5,5.5,6,7,6.5,8.5,5,6,6.5,7.5,6,7,7,8,7.5,6.5,6.5,8.5,7,6.5,6.5,5,6.5,6.5,7.5,5,6,6.5,9,8,7,6,7,7.5,7,8.5,6,7.5,6,7.5,3,5.5,7,9,3.5,8,4,5.5,7,8.5,7.5,5,5
1,"",0,5,5,5,4,5,6,7,7,6,5,6,6,5,6,5,6,5,6,5,5,5,5,5,5,6,5,5,5,5,5,5,5,8,7,6,7,6,6,7,7,6,8,7,6,7,7,6,6,6,5,6,6,5,5,8,7,5,4,6,6,6,6,7,7,7,7,7,7,7,6,7,7,7,7,7,6,6,6,6,7,7,6,6,5,7,7,6,5,6,7,1,1,1,1,1,1,0,2,"","Didn't seem like a good fit","1","",3,5,7,"It was pretty awkward especially at first. We mostly stuck with the cards. She seemed to have much more in depth answers than I did. I mostly gave shallow answers at first, but was more open to talking about my personal life near the end.","s","f24530244_f24771795","fall","f24530244","f24771795",5,4.5,5.5,7,5.5,6,5.5,5.5,5.5,5,5,5,5.5,5,5,5,7.5,6.5,6,7,7,6.5,7,6,5.5,6,5,7.5,4.5,6,6,7,7,7,6.5,7,7,6.5,6,6.5,6.5,5.5,7,5.5,6.5,7.5,2.5,3,8.5,7,5,8,8,4.5,3,6.5,3,9,8,6.5
0,"",0,5,5,9,8,4,5,4,6,8,8,9,8,3,3,6,7,5,6,6,5,9,9,5,5,7,7,5,4,4,5,6,7,3,4,3,3,9,7,6,7,5,6,8,9,7,8,5,5,1,3,7,6,1,2,7,5,9,8,7,6,8,8,6,6,4,5,8,8,6,6,7,6,9,9,7,6,6,6,3,3,7,7,2,1,6,6,8,8,6,6,3,6,3,3,4,3,0,2,"","We just didn't click.
","1","",1,2,4,"He was very nice, we just weren't a match. I did think he was very attractive physically, but he didn't have a cool outfit on which is important to me. He was a CCS compsci major and while he did not exemplify all the stereotypes for that he definitely did some. He talked about career a bit and he didn't really joke a lot. Like I don't think he attempted one single joke in the whole conversation. But he was nice and gave thoughtful answers so it was still an interesting experience, even though our conversation stayed pretty surface level.
","s","f24771795_f24530244","fall","f24771795","f24530244",5,8.5,4.5,5,8,8.5,3,6.5,5.5,5.5,9,5,7,4.5,4.5,6.5,3.5,3,8,6.5,5.5,8.5,7.5,5,2,6.5,1.5,6,8.5,6.5,8,6,4.5,8,6,6.5,9,6.5,6,3,7,1.5,6,8,6,5,7.5,6.5,6,7,7,6.5,7,6,5.5,6,5,7.5,4.5,6
0,"",0,5,5,6,5,7,7,6,6,5,5,5,5,6,6,6,5,6,6,4,5,5,5,4,3,5,5,5,5,6,5,6,6,6,6,5,5,7,7,4,4,5,5,6,5,5,5,5,6,6,6,6,5,5,5,5,5,6,5,5,5,6,6,5,5,5,6,6,6,5,5,5,6,7,6,6,6,5,6,5,5,6,6,5,5,6,6,5,5,6,5,4,3,4,4,3,4,1,2,"","","1","",6,6,2,"We had a very enjoyable time getting to know each other. We have a lot of things in common and we connected through those similarities. We laughed a lot and we both felt comfortable with each other.","r","f24192151_f24683568","fall","f24192151","f24683568",5,5.5,7,6,5,5,6,5.5,6,4.5,5,3.5,5,5,5.5,6,6,5,7,4,5,5.5,5,5.5,6,5.5,5,5,5.5,5,6,5,5.5,6,5,5.5,6.5,6,5.5,5,6,5,6,5,5.5,6.5,6,7,7,6.5,7,6.5,5.5,6,6,5.5,2,5.5,5,6
1,"",0,5,5,6,5,7,6,5,5,4,4,4,4,5,4,4,5,5,5,8,7,5,5,6,6,5,6,5,6,4,5,7,6,6,6,7,7,7,7,5,8,8,6,7,6,5,6,5,7,5,7,5,6,3,1,6,5,5,5,6,6,7,6,6,5,7,6,7,6,6,6,6,6,7,6,7,6,5,6,5,5,7,7,5,5,6,5,5,5,5,6,2,3,3,3,3,1,0,2,"","I am not interested in another date ","1","",2,2,2,"The date went pretty well, we did not have very much romantic chemistry but got along fine. Flirtation was minimal and there were some pauses as we talked. We walked around the lagoon and actually took too long to get back because we stayed out there too long. The conversation was good though. ","r","f24683568_f24192151","fall","f24683568","f24192151",5,5.5,6.5,5,4,4,4.5,4.5,5,7.5,5,6,5.5,5.5,4.5,6.5,6,7,7,6.5,7,6.5,5.5,6,6,5.5,2,5.5,5,6,6.5,5.5,6.5,6.5,6,6,6.5,6.5,5.5,5,7,5,5.5,5,5.5,5.5,6,5,7,3,5,6.5,5,6,7,5.5,5,5,5.5,5
1,"",0,4,5,8,8,4,4,5,5,5,6,6,6,5,3,8,7,5,5,5,5,4,3,3,3,7,8,5,5,6,6,3,8,8,8,3,3,7,8,5,8,6,6,9,9,6,6,4,6,6,7,5,8,3,3,8,8,7,8,7,6,7,8,7,6,7,7,8,8,6,6,8,8,9,7,9,8,6,7,7,8,9,8,4,4,6,6,8,8,7,7,2,2,1,2,2,2,1,2,"","","1","",3,5,6,"It was nice although more formal than my first one. Immediately she wanted to start by using the cards which put me off guard and made the conversation more forced and technical of ""you  answer, I answer, repeat."" Over time we were able to loosen up more and I introduced new questions not from the card. Overall she didn't seem as interested in the date or me as the first girl, though the vibes improved over time. I would be open to hanging out with her again in a platonic way as I think she's smart and solid to talk to/learn from.","r","f24158421_f24189848","fall","f24158421","f24189848",4.5,8,4,5,5.5,6,4,7.5,5,5,3.5,3,7.5,5,6,5.5,8,3,7.5,6.5,6,9,6,5,6.5,6.5,3,8,7.5,6.5,7.5,6.5,7,8,6,8,8,8.5,6.5,7.5,8.5,4,6,8,7,6.5,8.5,4.5,6,6.5,6,6.5,8,5.5,7.5,6,4,7.5,7,7.5
0,"",0,6,6,6,5,5,6,8,8,8,8,6,6,7,8,8,8,6,6,7,8,8,7,4,5,7,7,7,8,7,7,8,8,8,9,6,7,6,5,5,8,6,7,7,7,8,7,7,6,7,5,7,6,6,4,9,8,5,8,8,7,7,6,7,8,5,7,7,6,6,6,6,6,6,9,8,8,8,6,6,7,7,7,5,5,7,7,6,5,7,7,6,5,5,4,4,4,1,2,"","","1","",6,6,3,"I think that we had a lot in common, we have similar interests and outlooks on a lot of things. We talked about things other than the cards for the bulk of the conversation and I think we shared a similar sense of humor. I would consider pursuing another date with this person. He seems cool and someone that I would be friends with if anything else. 

","r","f24189848_f24158421","fall","f24189848","f24158421",6,5.5,5.5,8,8,6,7.5,8,6,7.5,7.5,4.5,7,7.5,7,8,8.5,6.5,5.5,6.5,6.5,7,7.5,6.5,6,6.5,5,8.5,6.5,7.5,6.5,7.5,6,6.5,6,6,7.5,8,7,6.5,7,5,7,5.5,7,5,7.5,3,7.5,5.5,7,8.5,6,5.5,6,7,4,8,7,6
1,"",0,6,6,6,6,5,6,7,7,7,7,7,7,6,6,6,7,6,6,5,6,6,6,4,3,6,5,6,5,6,6,5,5,5,5,6,7,7,7,10,9,6,6,10,10,7,7,6,6,6,6,6,6,0,0,6,6,6,6,6,6,7,5,6,6,6,7,6,7,7,6,7,7,9,9,7,7,6,7,6,6,7,6,2,2,6,6,6,6,6,6,3,3,4,3,3,4,1,2,"","","1","",5,5,4,"The cards were a good jumping off point for other topics we were more interested in. We found a good spot to talk near the hub. It felt great when we were both passionate about the same things, such as Hamilton. Overall it was a pleasant date.","s","f24519779_f24554874","fall","f24519779","f24554874",6,6,5.5,7,7,7,6,6.5,6,5.5,6,3.5,5.5,5.5,6,5,5,6.5,7,9.5,6,10,7,6,6,6,0,6,6,6,6,6,6.5,6.5,6.5,7,9,7,6.5,6,6.5,2,6,6,6,9,9,8.5,9,8.5,7.5,9.5,7,9,6.5,9,5,8.5,8.5,8.5
0,"",0,7,7,7,6,5,5,8,8,8,5,7,7,7,5,9,7,7,7,8,8,5,5,4,4,5,5,6,5,8,7,9,9,9,9,9,8,9,9,8,9,8,7,9,10,7,7,9,9,5,8,9,9,5,5,8,9,9,8,9,8,10,9,9,10,8,9,10,10,10,10,9,10,9,10,10,9,10,10,10,10,10,10,8,8,10,10,10,8,10,8,2,1,2,4,3,2,0,2,"","My date partner was cool I just don't see us talking outside of this context. ","1","",2,5,4,"The date was nice and wasn't too rigid (very casual). We did use the cards at first to talk about different things and then ventured off to talk about new topics. He was really sweet and I wish him the best. Would definitely do another blind date after this one. ","s","f24554874_f24519779","fall","f24554874","f24519779",7,6.5,5,8,6.5,7,6,8,7,8,5,4,5,5.5,7.5,9,9,8.5,9,8.5,7.5,9.5,7,9,6.5,9,5,8.5,8.5,8.5,9.5,9.5,8.5,10,10,9.5,9.5,9.5,10,10,10,8,10,9,9,5.5,6,7.5,7,9,6,10,7,6,6.5,6.5,1,7,6,6
0,"",0,8,7,9,9,7,8,8,8,7,9,8,8,8,8,8,9,6,8,8,7,7,7,7,4,8,9,8,8,9,9,9,10,10,10,10,8,8,9,5,3,7,5,8,8,7,5,7,9,10,9,6,6,4,0,7,8,8,8,6,8,9,9,10,9,6,8,9,10,9,7,8,8,8,7,8,7,7,9,10,10,6,6,3,4,9,9,7,7,8,9,4,4,5,5,4,4,1,2,"","","1","",4,5,4,"I was pretty easy-going, we had a few things in common. Our drive/passion for what we want to do in life was strong and I liked that.","r","f24995036_f24810103","fall","f24995036","f24810103",7.5,9,7.5,8,8,8,8,8.5,7,7.5,7,5.5,8.5,8,9,9.5,10,9,8.5,4,6,8,6,8,9.5,6,2,7.5,8,7,9,9.5,7,9.5,8,8,7.5,7.5,8,10,6,3.5,9,7,8.5,7.5,6,4.5,4,6.5,4.5,7.5,5,6,6,5,5,4.5,6,5
1,"",0,6,6,7,8,5,6,8,7,8,8,6,7,7,6,6,5,5,7,8,8,7,8,6,6,5,8,5,5,7,6,7,8,6,6,4,5,4,4,6,7,5,4,7,8,5,5,6,6,7,5,5,5,6,4,4,5,6,6,5,5,7,7,6,6,7,6,6,7,6,7,6,6,8,6,7,6,7,6,7,7,6,5,6,6,5,5,5,7,5,6,3,4,4,2,3,3,1,2,"","","1","",6,5,4,"I think because of where we are in life, we had a hard time finding things in common. I'm 23 and she's 28, I don't feel as though I can provide or relate to her as much as I could if we were the sane age. She was very easy to talk to and she made an effort to get to know me and keep the conversation going. She was a great person to get to know. ","r","f24810103_f24995036","fall","f24810103","f24995036",6,7.5,5.5,7.5,8,6.5,6.5,5.5,6,8,7.5,6,6.5,5,6.5,7.5,6,4.5,4,6.5,4.5,7.5,5,6,6,5,5,4.5,6,5,7,6,6.5,6.5,6.5,6,7,6.5,6.5,7,5.5,6,5,6,5.5,9.5,10,9,8.5,4,6,8,6,8,9.5,6,2,7.5,8,7
0,"",0,6,5,6,6,4,6,7,7,7,9,7,7,8,7,5,6,7,8,9,8,7,7,5,5,6,5,7,5,6,6,8,9,7,7,7,7,6,6,5,8,6,7,7,6,6,6,8,6,9,7,5,5,3,3,6,7,5,5,6,6,8,8,7,8,6,6,6,7,8,7,6,6,7,8,7,7,7,7,8,7,5,6,5,5,6,7,5,5,6,6,3,3,5,2,2,3,1,2,"","","1","",5,6,2,"It was easy to talk to him and I found that the conversations flowed easily. We only used the cards three times and then each time a different conversation came out of the question. We had similar interests and found it easy to talk to one another. We laughed a lot and had fun while talking.","r","f24990711_f24562668","fall","f24990711","f24562668",5.5,6,5,7,8,7,7.5,5.5,7.5,8.5,7,5,5.5,6,6,8.5,7,7,6,6.5,6.5,6.5,6,7,8,5,3,6.5,5,6,8,7.5,6,6.5,7.5,6,7.5,7,7,7.5,5.5,5,6.5,5,6,6.5,9,1,6,8,8.5,5.5,8,7.5,7.5,7,5.5,9,5.5,5
1,"",0,5,5,8,8,5,6,6,5,7,6,8,8,7,5,7,5,8,7,7,7,5,8,4,4,5,5,5,4,5,5,8,5,9,9,1,1,6,6,8,8,9,8,4,7,9,7,9,6,8,7,7,7,6,5,9,9,5,6,5,5,7,7,7,7,5,6,5,6,7,5,8,7,7,8,5,5,8,6,7,7,7,7,5,5,7,5,6,5,7,5,4,3,2,4,4,4,0,2,"","I did not feel the romantic or sexual connection.","1","",3,3,4,"I thought the date went well. The conversation flowed and both of us participated well and fairly equally. I thought it was fun to meet a new person but I was not attracted to my date. I think the nature of the date made it worse.","r","f24562668_f24990711","fall","f24562668","f24990711",5,8,5.5,5.5,6.5,8,6,6,7.5,7,6.5,4,5,4.5,5,6.5,9,1,6,8,8.5,5.5,8,7.5,7.5,7,5.5,9,5.5,5,7,7,5.5,5.5,6,7.5,7.5,5,7,7,7,5,6,5.5,6,7.5,6.5,6,6,7,7,7,5.5,8,7,5,3.5,6.5,5.5,6
1,"",0,6,5,5,5,5,5,6,6,5,5,6,7,7,6,7,5,5,7,4,3,6,6,0,0,5,5,5,5,5,5,7,7,8,9,5,5,7,7,5,7,9,8,9,7,6,7,7,6,6,5,7,7,1,2,5,9,7,6,8,7,6,5,8,8,5,5,7,6,5,5,7,7,6,7,6,6,6,8,5,5,7,6,5,2,5,5,5,6,5,6,5,5,6,5,4,4,1,2,"","","1","",6,5,2,"I'm surprised to have actually matched with an international student. She was nervous but it was fine because I came up with topics to talk about. The things we talked about were half and half about what you were looking for in your soulmate / personality and things like school. I enjoyed this experience.","r","f2499921_f24101704","fall","f2499921","f24101704",5.5,5,5,6,5,6.5,6.5,6,6,3.5,6,0,5,5,5,7,8.5,5,7,6,8.5,8,6.5,6.5,5.5,7,1.5,7,6.5,7.5,5.5,8,5,6.5,5,7,6.5,6,7,5,6.5,3.5,5,5.5,5.5,4.5,5,6,4,9,5,8,5.5,6,2.5,5,0,4.5,4,5
0,"",0,5,5,6,5,4,5,5,5,5,5,6,6,6,4,6,6,5,5,5,5,5,5,0,0,6,6,5,5,6,5,4,5,6,4,6,6,4,4,9,9,6,4,9,7,6,5,6,6,3,2,5,5,0,0,5,4,3,5,5,5,6,5,6,6,7,7,9,9,8,8,10,8,9,8,6,6,6,6,3,3,6,7,3,3,7,8,6,6,6,6,3,3,3,3,3,3,1,2,"","","1","",6,2,2,"Both of us are not very outgoing so that the date started not that successfully. Gradually, we started to talk more as we discussed how we knew this study and attended. After that we talked about some red flags we have in a relationship as well as topics related to courses, research and works/internships. Some activities we attend during leisure time were discussed as well. I feel like we do not have much in common. And I think it may be better for people who do not share similar personalities to date with each other since the similarity in personalities we have makes the conversation hard to proceed. Actually we all felt really awkward at the beginning of the date.","r","f24101704_f2499921","fall","f24101704","f2499921",5,5.5,4.5,5,5,6,5,6,5,5,5,0,6,5,5.5,4.5,5,6,4,9,5,8,5.5,6,2.5,5,0,4.5,4,5,5.5,6,7,9,8,9,8.5,6,6,3,6.5,3,7.5,6,6,7,9,5.5,7.5,5.5,8.5,8.5,7,7.5,5,6.5,3,7.5,6.5,7
0,"",0,3,5,6,5,3,3,5,5,5,5,4,4,6,3,8,8,7,6,5,5,4,2,5,5,6,7,3,3,6,5,10,9,8,9,9,10,10,9,7,8,8,8,10,10,8,8,9,8,8,8,10,10,3,4,7,8,8,10,9,8,9,10,8,9,7,8,8,7,7,8,8,8,9,10,9,8,8,8,8,7,10,10,3,3,9,8,10,10,9,7,1,1,1,3,2,4,0,2,"","Just didn't click in that format
","1","",3,3,1,"They're a nice person, gaining credits for their degree. We didn't really connect on much. Just talked about our majors, barely made eye contact. I wasn't satisfied on this date at all. 
","s","f24687888_f24173430","fall","f24687888","f24173430",4,5.5,3,5,5,4,4.5,8,6.5,5,3,5,6.5,3,5.5,9.5,8.5,9.5,9.5,7.5,8,10,8,8.5,8,10,3.5,7.5,9,8.5,9.5,8.5,7.5,7.5,7.5,8,9.5,8.5,8,7.5,10,3,8.5,10,8,6,6,5,7.5,8,5.5,6.5,7.5,5.5,5.5,6,0,6.5,6.5,6
1,"",0,6,5,7,8,8,8,6,6,6,7,6,6,6,6,6,6,6,6,5,6,6,7,5,5,4,7,5,5,6,6,5,6,4,5,5,5,7,7,8,8,5,5,7,6,7,7,5,6,5,5,6,6,0,0,5,7,6,6,7,7,6,7,6,6,5,5,8,7,8,8,6,6,7,7,8,7,7,6,5,10,10,10,0,0,6,6,10,7,6,6,4,5,5,4,3,3,1,2,"","","1","",3,2,1,"We went on a walk around the lagoon and talked to each other. It was quite a nice date, although I think I liked the first one more. (I liked her, but we didn't seem to have much in common). It was pretty good overall though.","s","f24173430_f24687888","fall","f24173430","f24687888",5.5,7.5,8,6,6.5,6,6,6,6,5.5,6.5,5,5.5,5,6,5.5,4.5,5,7,8,5,6.5,7,5.5,5,6,0,6,6,7,6.5,6,5,7.5,8,6,7,7.5,6.5,7.5,10,0,6,8.5,6,9,9,8.5,8,6.5,8,9,9.5,8.5,9.5,10,3.5,6.5,9,8
0,"",0,6,6,8,8,4,5,6,8,6,6,8,7,6,6,4,7,6,8,9,8,6,6,5,5,7,8,5,5,6,6,6,9,8,8,1,3,4,4,10,10,5,6,8,7,9,9,7,7,5,7,6,6,1,0,9,10,5,7,7,6,7,8,8,8,5,4,7,7,8,8,5,6,7,8,8,8,7,7,7,8,7,7,1,1,9,9,7,6,7,6,3,4,4,4,4,4,0,2,"","I chose not to exchange numbers with my date partner because he is a first year. He seemed really kind and interesting, but pursuing a romantic relationship with someone younger than me feels a little taboo or at least uncomfortable. ","1","",3,4,1,"The date was quite nice. I think that my partner was very interesting and engaged. We both had a lot to talk about and there were no lulls in the conversation. He seemed like a very nice guy who had a lot of things to look forward to here in SB.","s","f24252257_f24975309","fall","f24252257","f24975309",6,8,4.5,7,6,7.5,6,5.5,7,8.5,6,5,7.5,5,6,7.5,8,2,4,10,5.5,7.5,9,7,6,6,0.5,9.5,6,6.5,7.5,8,4.5,7,8,5.5,7.5,8,7,7.5,7,1,9,6.5,6.5,5,6,5,7,7.5,7,6,5.5,6,8,5,2,7,5.5,5
1,"",0,5,5,7,5,5,5,5,5,5,5,7,6,5,5,6,6,5,5,5,5,8,7,5,5,5,8,5,4,5,5,5,5,6,6,5,5,7,7,5,8,6,6,7,6,6,6,5,7,7,7,5,5,2,2,7,6,5,7,5,5,5,5,5,6,5,5,7,7,5,5,6,6,7,6,6,5,6,7,7,7,6,7,2,2,6,5,5,6,5,5,5,5,5,3,3,3,1,2,"","","1","",3,4,1,"She was very attractive but our personalities were not that similar. I think that our conversation was good but not amazing but she seemed very nice. She did not make a lot of eye contact which is something that I find important. She seemed very smart which is good but maybe not the most dynamic person. ","s","f24975309_f24252257","fall","f24975309","f24252257",5,6,5,5,5,6.5,5,6,5,5,7.5,5,6.5,4.5,5,5,6,5,7,6.5,6,6.5,6,6,7,5,2,6.5,6,5,5,5.5,5,7,5,6,6.5,5.5,6.5,7,6.5,2,5.5,5.5,5,6,7,2.5,2.5,9,5.5,9,8.5,6,6.5,6.5,0.5,8.5,4.5,6
0,"",0,6,6,7,8,5,5,6,8,8,5,6,7,6,5,7,7,5,7,4,5,5,3,5,5,8,8,4,5,5,6,6,8,7,6,4,5,7,7,9,10,7,6,8,7,7,8,7,7,6,8,5,5,0,0,7,8,6,8,6,6,6,7,7,6,5,5,6,7,8,8,6,5,8,8,7,8,6,6,7,8,4,4,5,5,5,6,5,6,8,7,4,2,3,3,3,4,0,2,"","We had good conversation but I feel like I need to spend more time with someone before setting the expectations of being romantically interested.","1","",6,5,3,"We had good conversation that did not rely on just the cards. Basic information and icebreakers were easy and didn't seem forced or awkward. We seemed to have a decent amount in common but there was still a little awkwardness to it. There wasn't any immediate click or connection but he was easy to talk to.","r","f24754638_f24587925","fall","f24754638","f24587925",6,7.5,5,7,6.5,6.5,5.5,7,6,4.5,4,5,8,4.5,5.5,7,6.5,4.5,7,9.5,6.5,7.5,7.5,7,7,5,0,7.5,7,6,6.5,6.5,5,6.5,8,5.5,8,7.5,6,7.5,4,5,5.5,5.5,7.5,6,4.5,3,6,9,5,6.5,7.5,6.5,5.5,5,0,6,6.5,5
1,"",0,5,5,8,8,7,8,7,8,9,9,8,7,8,7,9,8,7,7,6,8,7,6,5,5,7,8,5,5,7,7,6,7,5,5,4,4,7,8,8,8,5,5,7,7,7,7,6,6,6,5,4,3,5,6,5,5,5,7,5,5,7,7,5,6,5,5,7,8,8,8,5,6,8,7,7,7,7,7,6,5,6,5,5,5,5,5,5,5,6,5,5,5,6,4,3,3,1,2,"","","1","",5,5,5,"I enjoyed the date because we had similar thoughts on most of the topics we talked about. However, I feel like I had to do most of the talking. There were many times where I wanted her to elaborate on a subject that we were talking about so that I could learn a little more about her. Overall, I feel like the date went okay, but might have been more fluid in a more comfortable environment.","r","f24587925_f24754638","fall","f24587925","f24754638",5,8,7.5,7.5,9,7.5,7.5,8.5,7,7,6.5,5,7.5,5,7,6.5,5,4,7.5,8,5,7,7,6,5.5,3.5,5.5,5,6,5,7,5.5,5,7.5,8,5.5,7.5,7,7,5.5,5.5,5,5,5,5.5,8,6.5,4,8,7.5,5.5,7.5,7.5,7.5,6,4,4.5,6,7,5
1,"",0,4,3,7,7,5,5,5,3,3,3,3,3,5,2,7,7,5,5,4,5,2,2,2,1,5,5,3,5,5,5,6,7,6,6,5,6,5,5,6,7,5,4,4,5,5,5,5,4,6,6,5,5,3,2,5,6,5,6,5,5,5,6,6,6,5,6,6,6,6,6,5,5,6,5,5,4,5,6,5,5,6,5,4,4,5,5,5,5,5,5,2,1,4,2,2,2,1,2,"","","1","",5,3,1,"We used one singular card and that is all which makes me think it went smoothly. It was difficult to discuss due to differences in accents. Talking about difference in cultures was interesting. We used our phones a lot to show each other what we were referring to since our countries are very different, she from China and I from Argentina.","s","f24583377_f24253455","fall","f24583377","f24253455",3.5,7,5,4,3,3,3.5,7,5,4.5,2,1.5,5,4,5,6.5,6,5.5,5,6.5,4.5,4.5,5,4.5,6,5,2.5,5.5,5.5,5,5.5,6,5.5,6,6,5,5.5,4.5,5.5,5,5.5,4,5,5,5,5,5,5,6,5,5,5,5,5,5,5,5,5,5,5
0,"",0,5,6,5,6,5,6,7,6,10,7,6,6,6,5,5,5,6,6,7,6,5,5,6,5,4,5,5,5,6,6,5,6,5,6,5,6,6,7,6,6,7,5,6,5,6,5,6,5,6,5,5,5,5,5,6,6,5,6,5,6,6,5,5,5,5,5,7,6,5,6,6,6,7,6,5,5,6,7,5,5,5,5,5,5,6,5,6,7,5,5,5,4,6,5,4,5,1,2,"","","1","",6,5,2,"It's a good talk. We both come from different countries and have really different culture, but we still have something in common. We love our family and have passionate in food and trip. We spent most of time sharing food to each other and it should be good if we can continue sharing opinions of different restaurants to each other. I learned a lot about Argentina's culture how can you imagine they use copybara's skin to make wallet. :)","s","f24253455_f24583377","fall","f24253455","f24583377",5.5,5.5,5.5,6.5,8.5,6,5.5,5,6,6.5,5,5.5,4.5,5,6,5.5,5.5,5.5,6.5,6,6,5.5,5.5,5.5,5.5,5,5,6,5.5,5.5,5.5,5,5,6.5,5.5,6,6.5,5,6.5,5,5,5,5.5,6.5,5,6.5,6,5.5,5,6.5,4.5,4.5,5,4.5,6,5,2.5,5.5,5.5,5
1,"",0,6,7,10,10,5,7,10,10,5,10,5,5,8,7,6,7,10,10,10,10,5,5,7,8,6,6,5,5,5,10,5,5,7,7,6,7,5,5,7,5,7,5,7,7,5,7,6,10,5,5,5,5,4,4,6,6,5,6,5,6,6,6,8,7,5,6,8,8,8,8,7,8,9,8,8,8,8,7,5,5,7,6,5,5,7,7,6,5,6,7,2,1,1,1,1,1,0,NA,"","I feel like we are too different in personality and life philosophy.","1","",2,4,4,"It was pretty solid. I wished it wasn't all pysch kids doing it for credit. But I enjoyed talking to the person. It was a cool experience overall. ","r","f24697361_f24742031","fall","f24697361","f24742031",6.5,10,6,10,7.5,5,7.5,6.5,10,10,5,7.5,6,5,7.5,5,7,6.5,5,6,6,7,6,8,5,5,4,6,5.5,5.5,6,7.5,5.5,8,8,7.5,8.5,8,7.5,5,6.5,5,7,5.5,6.5,7.5,7,6,7.5,7.5,7,6,7,7.5,8,7,7,7,7,7.5
0,"",2,4,4,6,5,5,4,5,4,6,6,5,6,5,5,6,6,5,6,5,4,5,5,4,4,5,5,NA,NA,5,5,7,7,7,7,6,7,7,7,7,8,6,7,6,5,6,6,7,7,8,8,7,7,7,7,6,6,7,NA,7,8,7,7,7,7,5,7,7,7,8,8,7,7,7,6,7,6,7,7,8,7,7,7,7,8,6,6,7,6,7,7,1,1,1,1,1,1,0,2,"","Im currently seeing someone at the moment so out of respect to him I wouldn't want to exchange information.
He seems sweet and genuine but I felt no connection either.","1","",3,3,7,"'- He was a sweet and genuine guy but I didn't feel any connection towards him.
- I don't think our religious beliefs align either and that is a big thing for me.
- He was a bit nervous I could tell and it started making me feel a bit nervous as well.
- Overall it wasn't the worst date I've been on but there definitely wasn't a connection there.","r","f24742031_f24697361","fall","f24742031","f24697361",4,5.5,4.5,4.5,6,5.5,5,6,5.5,4.5,5,4,5,NA,5,7,7,6.5,7,7.5,6.5,5.5,6,7,8,7,7,6,7,7.5,7,7,6,7,8,7,6.5,6.5,7,7.5,7,7.5,6,6.5,7,5,7,6.5,5,6,6,7,6,8,5,5,4,6,5.5,5.5
1,"",0,6,6,6,6,7,7,6,6,8,5,4,4,8,6,6,7,5,6,6,6,5,6,4,4,5,6,4,5,6,6,8,9,7,8,5,6,7,7,8,8,8,8,8,8,7,7,6,7,7,9,8,8,2,2,7,7,8,9,8,8,7,8,7,7,5,5,7,7,7,8,8,8,7,8,6,6,8,7,8,8,8,8,4,4,6,8,8,8,6,5,4,4,4,5,5,5,1,2,"","","1","",5,3,1,"I thought that the date went okay. My date partner did show up late which did tell me a lot. We talked a lot about our hobbies and how life has been so far in college. Some moments of silence but other than that there was a smooth flowing conversation","r","f24100694_f24988714","fall","f24100694","f24988714",6,6,7,6,6.5,4,7,6.5,5.5,6,5.5,4,5.5,4.5,6,8.5,7.5,5.5,7,8,8,8,7,6.5,8,8,2,7,8.5,8,7.5,7,5,7,7.5,8,7.5,6,7.5,8,8,4,7,8,5.5,8.5,7.5,6,7.5,7,7.5,9,7,7.5,7.5,9,0,7,6.5,6.5
0,"",0,6,7,7,6,5,5,8,8,8,7,9,8,5,7,8,8,5,7,5,5,9,9,5,5,8,7,8,5,7,7,9,8,8,8,6,7,8,8,7,6,8,8,9,9,8,8,8,8,8,7,8,8,0,0,8,8,7,7,7,7,8,8,7,8,7,5,7,6,7,7,9,8,7,8,8,8,7,8,8,6,9,8,0,0,8,7,8,6,7,7,5,6,5,3,3,3,1,2,"","","1","",4,3,1,"the date was fun, i liked him a lot better. He was really cool, but I don't think he was very interested in me. He was nice to talk  to, it was never really awkward. I think he's funny, too, and attractive. I'm quite interested in him, but, again, I didn't really catch a vibe of him being very interested in me.","r","f24988714_f24100694","fall","f24988714","f24100694",6.5,6.5,5,8,7.5,8.5,6,8,6,5,9,5,7.5,6.5,7,8.5,8,6.5,8,6.5,8,9,8,8,7.5,8,0,8,7,7,8,7.5,6,6.5,7,8.5,7.5,8,7.5,7,8.5,0,7.5,7,7,8,7,5,6,8,7.5,8,6,8,9,8,2,7.5,8.5,8
1,"",0,5,5,6,8,9,9,6,8,5,7,5,7,8,4,8,7,6,8,5,5,5,9,5,5,3,4,5,5,7,8,6,9,7,6,5,3,7,8,6,8,7,8,8,4,9,8,8,8,8,9,9,7,0,2,10,10,9,8,8,6,9,8,7,7,7,8,7,7,10,7,7,10,7,7,7,9,7,7,7,8,7,7,5,5,10,10,10,10,7,10,4,5,7,3,2,5,1,2,"","","1","",4,5,4,"We didn't use the cards until the last 10 minutes of the date but we hit on most/all of the topics listed on the cards. I am hoping to go on a second date with Tomika later","r","f24307924_f2446108","fall","f24307924","f2446108",5,7,9,7,6,6,6,7.5,7,5,7,5,3.5,5,7.5,7.5,6.5,4,7.5,7,7.5,6,8.5,8,8.5,8,1,10,8.5,7,8.5,7,7.5,7,8.5,8.5,7,8,7,7.5,7,5,10,10,8.5,7,7,10,7.5,8,7,9.5,8,9,9,8,1,5,8.5,8.5
0,"",0,7,8,8,6,1,3,8,6,4,7,8,8,8,3,5,8,7,8,7,7,5,6,6,6,7,9,2,9,9,5,7,7,7,7,10,10,8,7,8,8,7,7,10,9,9,7,9,9,9,9,8,8,2,0,5,5,9,8,8,9,8,8,7,7,5,5,7,8,7,5,8,8,9,9,8,8,6,10,8,9,8,7,5,4,9,8,9,9,7,8,1,1,1,5,6,6,0,2,"","I found him very nice but I just don't think the romantic/sexual attraction was there, as well as conversational chemistry and connection","1","",2,2,2,"I thought it was a very interesting experience, I honestly would be interested in this format of dating again. It forces you to meet people outside of the superficiality Tinder/Dating apps and spend time with someone outside of your social circle. ","r","f2446108_f24307924","fall","f2446108","f24307924",7.5,7,2,7,5.5,8,5.5,6.5,7.5,7,5.5,6,8,5.5,7,7,7,10,7.5,8,7,9.5,8,9,9,8,1,5,8.5,8.5,8,7,5,7.5,6,8,9,8,8,8.5,7.5,4.5,8.5,9,7.5,7.5,6.5,4,7.5,7,7.5,6,8.5,8,8.5,8,1,10,8.5,7
1,"",0,5,5,5,5,3,5,6,5,6,6,5,5,5,4,6,6,5,7,5,5,4,4,0,0,5,6,2,5,5,5,7,7,9,8,4,5,9,8,10,9,10,8,9,10,7,7,6,7,7,7,5,7,0,0,9,8,9,8,7,7,6,7,5,6,5,6,7,7,8,8,8,7,8,8,6,7,5,6,8,8,8,8,0,0,7,7,8,7,7,7,1,1,2,4,4,4,0,2,"","Because I do not see a relationship forming, we are different vibes. We do have things in common so maybe a friendship.","1","",3,5,1,"It was cool talking to a new person. I was honestly surprised at some of the things we had in common, such as playing soccer for several years. The date went well and we didn't run out of things to talk about. Unfortunately, I am not physically attracted to my date. Still, good experience.","r","f2431923_f24505181","fall","f2431923","f24505181",5,5,4,5.5,6,5,4.5,6,6,5,4,0,5.5,3.5,5,7,8.5,4.5,8.5,9.5,9,9.5,7,6.5,7,6,0,8.5,8.5,7,6.5,5.5,5.5,7,8,7.5,8,6.5,5.5,8,8,0,7,7.5,7,5,8,6,8.5,10,6,9,6.5,8.5,6.5,6,0,6,5,7.5
