"sex","sex_4_TEXT","relStat","dateAffectionate1","dateAffectionate2","dateAmbition1","dateAmbition2","dateArtistic1","dateArtistic2","dateDisposition1","dateDisposition2","dateFamily1","dateFamily2","dateHealth1","dateHealth2","dateHumor1","dateHumor2","dateIntelligent1","dateIntelligent2","dateKind1","dateKind2","dateParenting1","dateParenting2","datePhysatt1","datePhysatt2","dateReligious1","dateReligious2","dateResources1","dateResources2","dateSexy1","dateSexy2","dateStatus1","dateStatus2","selfAffectionate1","selfAffectionate2","selfAmbition1","selfAmbition2","selfArtistic1","selfArtistic2","selfDisposition1","selfDisposition2","selfFamily1","selfFamily2","selfHealth1","selfHealth2","selfHumor1","selfHumor2","selfIntelligent1","selfIntelligent2","selfKind1","selfKind2","selfParenting1","selfParenting2","selfPhysatt1","selfPhysatt2","selfReligious1","selfReligious2","selfResources1","selfResources2","selfSexy1","selfSexy2","selfStatus1","selfStatus2","idealAffection1","idealAffection2","idealAmbition1","idealAmbition2","idealArtistic1","idealArtistic2","idealDisposition1","idealDisposition2","idealFamily1","idealFamily2","idealHealth1","idealHealth2","idealHumor1","idealHumor2","idealIntelligent1","idealIntelligent2","idealKind1","idealKind2","idealParenting1","idealParenting2","idealPhysatt1","idealPhysatt2","idealReligious1","idealReligious2","idealResources1","idealResources2","idealSexy1","idealSexy2","idealStatus1","idealStatus2","ltAttraction","stAttraction","dateInterest","ltAttractionDate","stAttractionDate","dateInterestDate","contactExchange","prevContactExchange","prevContactExchange_1_TEXT","noExchange.","prevKnown","prevKnown_7_TEXT","similarity2.","similarity1","cardUse","openEndedEval","c","p","quarter","PIN","mPIN","dateAffectionateComp","dateAmbitionComp","dateArtisticComp","dateDispositionComp","dateFamilyComp","dateHealthComp","dateHumorComp","dateIntelligentComp","dateKindComp","dateParentingComp","datePhysattComp","dateReligiousComp","dateResourcesComp","dateSexyComp","dateStatusComp","selfAffectionateComp","selfAmbitionComp","selfArtisticComp","selfDispositionComp","selfFamilyComp","selfHealthComp","selfHumorComp","selfIntelligentComp","selfKindComp","selfParentingComp","selfPhysattComp","selfReligiousComp","selfResourcesComp","selfSexyComp","selfStatusComp","idealAffectionComp","idealAmbitionComp","idealArtisticComp","idealDispositionComp","idealFamilyComp","idealHealthComp","idealHumorComp","idealIntelligentComp","idealKindComp","idealParentingComp","idealPhysattComp","idealReligiousComp","idealResourcesComp","idealSexyComp","idealStatusComp","mateAffectionateComp","mateAmbitionComp","mateArtisticComp","mateDispositionComp","mateFamilyComp","mateHealthComp","mateHumorComp","mateIntelligentComp","mateKindComp","mateParentingComp","matePhysattComp","mateReligiousComp","mateResourcesComp","mateSexyComp","mateStatusComp"
1,"",1,4,6,7,7,9,10,6,5,7,7,5,3,7,5,6,7,7,8,6,6,6,4,5,7,8,8,2,3,6,6,8,5,7,7,2,4,6,6,6,4,7,6,7,7,5,6,7,6,9,6,6,4,6,7,6,7,7,7,7,5,5,5,5,5,5,5,5,5,5,5,5,5,5,5,5,5,5,5,6,5,5,5,5,3,6,5,5,5,6,5,5,3,4,4,3,3,1,2,"","","1","",5,5,1,"I loved talking to her! She was super nice, and was pretty funny honestly. We had some similar interests and didn't really struggle on finding things to talk about. She's very pretty and has a nice smile! ","s","f24845585_f24708573","fall","f24845585","f24708573",5,7,9.5,5.5,7,4,6,6.5,7.5,6,5,6,8,2.5,6,6.5,7,3,6,5,6.5,7,5.5,6.5,7.5,5,6.5,6.5,7,6,5,5,5,5,5,5,5,5,5,5.5,5,4,5.5,5,5.5,6,3.5,7,6.5,7,5,8,6,6.5,6,5,0,6,5,5
0,"",0,5,5,5,5,3,4,6,5,5,5,7,8,6,5,7,5,5,6,5,5,6,6,5,5,6,7,5,5,6,5,5,7,4,3,7,7,7,6,6,8,5,5,10,6,5,7,6,7,6,6,5,5,0,0,4,8,5,5,5,5,6,6,5,5,7,7,6,5,6,6,5,5,6,7,7,6,6,6,6,6,5,5,0,0,5,7,5,5,5,5,2,2,4,2,2,3,1,2,"","","1","",6,6,2,"Was very nice! But I feel like it's also important to take into account dietary choices. My date is a fantastic person but unfortunately he's vegetarian and I am not interested in dating someone who is vegetarian.","s","f24708573_f24845585","fall","f24708573","f24845585",5,5,3.5,5.5,5,7.5,5.5,6,5.5,5,6,5,6.5,5,5.5,6,3.5,7,6.5,7,5,8,6,6.5,6,5,0,6,5,5,6,5,7,5.5,6,5,6.5,6.5,6,6,5,0,6,5,5,6.5,7,3,6,5,6.5,7,5.5,6.5,7.5,5,6.5,6.5,7,6
0,"",0,6,5,8,8,9,9,8,8,5,7,7,8,5,6,8,8,6,6,5,5,6,6,2,1,5,8,5,5,5,5,8,8,8,8,5,6,7,5,8,10,8,9,8,7,6,5,6,7,2,5,5,5,2,0,5,8,5,5,5,7,8,8,8,8,5,6,8,7,8,8,8,8,7,7,8,7,8,8,5,7,7,6,5,5,8,8,6,7,6,7,2,2,1,1,1,2,1,2,"","","1","",5,5,5,"It was fun and good to meet someone new. I would enjoy being friends with this person. ","s","f24917799_f24528591","fall","f24917799","f24528591",5.5,8,9,8,6,7.5,5.5,8,6,5,6,1.5,6.5,5,5,8,8,5.5,6,9,8.5,7.5,5.5,6.5,3.5,5,1,6.5,5,6,8,8,5.5,7.5,8,8,7,7.5,8,6,6.5,5,8,6.5,6.5,4.5,7,7,6.5,6,6,6,6,5.5,3,6,1.5,6,4.5,5.5
1,"",0,5,5,6,6,4,4,5,4,3,5,7,7,4,3,5,5,5,5,3,3,6,5,2,2,5,6,5,5,6,6,5,4,7,7,7,7,6,7,5,7,6,6,6,6,8,4,5,6,3,3,7,5,2,1,5,7,5,4,6,5,7,5,7,7,5,6,6,5,5,5,6,6,6,6,7,6,6,6,5,5,8,6,2,2,5,6,5,5,6,6,3,3,4,2,2,3,1,2,"","","1","",3,3,3,"I feel like the conversation was a lot more genuine/enjoyable when we finished getting through the cards, otherwise it felt really icebreaker-y. Other than that, I think we'd just be the type of good friends that say hi to each other when we see each other but dont hang out often. Maybe it has to do with setting? I wonder if I would have to meet someone at a party or different social setting to see them in a romantic light.","s","f24528591_f24917799","fall","f24528591","f24917799",5,6,4,4.5,4,7,3.5,5,5,3,5.5,2,5.5,5,6,4.5,7,7,6.5,6,6,6,6,5.5,3,6,1.5,6,4.5,5.5,6,7,5.5,5.5,5,6,6,6.5,6,5,7,2,5.5,5,6,8,8,5.5,6,9,8.5,7.5,5.5,6.5,3.5,5,1,6.5,5,6
1,"",0,6,6,7,7,7,7,7,7,7,7,8,7,5,5,9,8,7,7,7,6,7,7,5,5,8,6,5,5,8,8,6,5,6,6,2,3,6,5,6,7,3,4,9,6,7,7,8,8,3,7,6,5,4,4,7,7,4,5,6,6,7,6,8,7,7,7,8,6,6,6,7,7,7,8,8,8,7,9,2,4,5,5,4,4,8,7,5,5,7,7,4,1,1,2,1,1,0,2,"","I think she is really cool, but our studies don't overlap that much so I wouldn't want to take things further.","1","",3,5,1,"She asked most questions to start conversation. I think I gave long winded explanations with some stories I thought were relevant. Since we didn't use the cards I was curious what they have on them.","r","f24331064_f24432246","fall","f24331064","f24432246",6,7,7,7,7,7.5,5,8.5,7,6.5,7,5,7,5,8,5.5,6,2.5,5.5,6.5,3.5,7.5,7,8,5,5.5,4,7,4.5,6,6.5,7.5,7,7,6,7,7.5,8,8,3,5,4,7.5,5,7,5.5,7,4.5,7,6.5,6,7.5,7.5,8,5,6,1,7.5,5,6.5
0,"",0,5,4,8,8,6,5,5,5,5,5,5,5,4,4,8,7,5,6,5,5,4,4,5,5,5,8,2,4,5,5,6,5,7,7,4,5,7,7,6,7,6,6,8,7,7,8,8,8,5,5,6,6,1,1,8,7,5,5,7,6,6,5,7,7,5,6,6,6,6,6,7,6,8,8,6,6,8,7,5,5,6,6,1,1,7,7,6,6,7,7,2,1,2,3,2,4,0,2,"","I don't think I would have been naturally drawn to this person and we don't really seem to have much in common. ","1","",3,2,1,"It was overall a pleasant experience. I definitely led the conversation and asked most of the questions and he would occasionally return questions to me. I would have liked him to ask me more about my own interests. He was overall very nice but I don't think that would would naturally cross paths or be drawn to each other. There were some awkward pauses that I mostly made an attempt to fill but overall it was an interesting experience. Turns out one of his friends is an acquaintance of mine!","r","f24432246_f24331064","fall","f24432246","f24331064",4.5,8,5.5,5,5,5,4,7.5,5.5,5,4,5,6.5,3,5,5.5,7,4.5,7,6.5,6,7.5,7.5,8,5,6,1,7.5,5,6.5,5.5,7,5.5,6,6,6.5,8,6,7.5,5,6,1,7,6,7,5.5,6,2.5,5.5,6.5,3.5,7.5,7,8,5,5.5,4,7,4.5,6
0,"",0,3,3,5,5,4,4,5,6,5,6,5,5,2,2,5,7,4,6,7,5,2,3,2,2,6,5,2,3,5,5,3,3,7,7,6,6,6,5,4,4,8,8,7,7,7,7,5,5,5,6,6,6,1,1,5,5,4,4,6,6,5,4,7,6,5,5,6,6,5,4,6,6,8,8,6,6,7,8,6,5,6,7,1,1,5,6,6,5,6,6,1,1,1,1,1,1,0,2,"","He was very nice but I don't think we would necessarily be friends! I think our beliefs were pretty similar but our personalities didn't really line up","1","",5,5,5,"He was very nice but I do not really see compatibility for us romantically. I feel like he was a little bit more shy which is fine because I could talk to a brick wall. We clearly were very similar people based on our values but I just don't think he has a silly personality and I am a silly person so I don't think we would have the most fun together. It was a fine date experience but it just felt like I was getting to know a friend!","r","f24428004_f24736838","fall","f24428004","f24736838",3,5,4,5.5,5.5,5,2,6,5,6,2.5,2,5.5,2.5,5,3,7,6,5.5,4,8,7,7,5,5.5,6,1,5,4,6,4.5,6.5,5,6,4.5,6,8,6,7.5,5.5,6.5,1,5.5,5.5,6,4.5,7,4,8.5,5.5,8,3.5,7.5,5,6.5,3,0,8,1.5,7.5
1,"",0,5,5,8,7,5,5,5,8,5,6,10,10,7,4,7,6,6,7,10,6,8,8,0,0,5,5,5,4,7,7,4,5,7,7,4,4,8,9,4,7,8,8,2,5,8,7,6,4,8,5,3,3,0,0,10,6,3,0,7,8,6,6,7,7,5,5,8,5,7,6,7,7,5,7,8,6,7,6,5,5,7,5,0,0,10,5,3,0,7,7,3,1,3,1,1,4,1,2,"","","1","",6,6,5,"It is really difficult to judge someone based off of 35 minutes of conversation. I think we were suitably matched in theory. Personally there wasn't any kind of obvious reason why they would make an ideal partner.
I'm not sure I could make any sort of judgment with such little time spent getting to know someone, particularly given that I don't experience sexual attraction.","r","f24736838_f24428004","fall","f24736838","f24428004",5,7.5,5,6.5,5.5,10,5.5,6.5,6.5,8,8,0,5,4.5,7,4.5,7,4,8.5,5.5,8,3.5,7.5,5,6.5,3,0,8,1.5,7.5,6,7,5,6.5,6.5,7,6,7,6.5,5,6,0,7.5,1.5,7,3,7,6,5.5,4,8,7,7,5,5.5,6,1,5,4,6
0,"",0,5,5,6,6,6,6,7,7,3,4,7,6,5,5,5,5,6,6,3,4,5,7,0,0,4,6,6,6,5,5,6,10,9,10,3,6,6,6,4,5,8,8,9,5,9,8,9,8,5,5,5,7,1,0,7,8,6,6,5,6,6,8,9,8,5,7,6,9,5,5,7,7,5,5,8,6,8,8,5,5,5,8,1,0,6,5,6,6,5,5,4,5,5,3,3,4,1,2,"","","1","",5,6,5,"I thought he was a very good match based on the responses that I originally gave in the survey, he seemed to share a lot of the same values and ideas. As we were going through the cards I was beginning to tell that his responses were very close to mine on certain things. I liked that we were able to connect over these. Overall I think the date went really well and he seemed to have almost everything I was looking for! The date was obviously a little short though and we mostly went off the cards except for a few topics. He seemed like a really genuine person and id be interested in getting to know him more since this was just surface level. ","r","f24396610_f24901138","fall","f24396610","f24901138",5,6,6,7,3.5,6.5,5,5,6,3.5,6,0,5,6,5,8,9.5,4.5,6,4.5,8,7,8.5,8.5,5,6,0.5,7.5,6,5.5,7,8.5,6,7.5,5,7,5,7,8,5,6.5,0.5,5.5,6,5,6,6,6,4,8,8.5,5.5,5,6.5,6,6,1.5,5.5,7,4.5
1,"",0,5,5,9,9,1,3,7,6,4,4,8,6,6,5,8,9,7,6,6,5,8,7,0,0,10,8,4,5,8,6,6,6,7,5,5,7,3,5,8,8,8,9,5,6,5,5,5,8,6,6,4,8,2,1,5,6,6,8,5,4,7,6,7,7,5,5,9,5,5,5,6,7,7,7,7,6,6,7,6,7,7,9,3,1,6,5,7,8,5,5,6,6,7,4,4,5,1,2,"","","1","",5,4,5,"I think we connected well, we were able to have conversations from the cards that branched out beyond the immediate question. I think the fact that we did not get through all the cards within our time limit is a good thing, as we had steady conversations going for a long time. I found her attractive, however my only slight concern is our age gap, as I am 21 and a junior and she is 18 and a freshman, which is outside of my ideal age range (2 years up or down from my own). I think she is a very intelligent and well-rounded person from the little bit I got to know her from, and I would be interested in getting to know her further. I think we both had positive attitudes during the date and it felt like we were both happy to be here.","r","f24901138_f24396610","fall","f24901138","f24396610",5,9,2,6.5,4,7,5.5,8.5,6.5,5.5,7.5,0,9,4.5,7,6,6,6,4,8,8.5,5.5,5,6.5,6,6,1.5,5.5,7,4.5,6.5,7,5,7,5,6.5,7,6.5,6.5,6.5,8,2,5.5,7.5,5,8,9.5,4.5,6,4.5,8,7,8.5,8.5,5,6,0.5,7.5,6,5.5
1,"",0,5,5,7,7,4,5,5,5,6,7,6,7,6,5,7,7,6,6,6,5,6,6,4,4,6,7,5,5,6,8,6,5,5,4,4,6,7,6,7,7,8,7,6,5,7,6,7,7,7,7,6,6,4,5,5,5,7,5,5,5,6,5,5,6,5,5,6,5,6,6,7,8,6,7,7,6,6,7,7,6,6,6,5,5,6,5,6,5,6,5,5,3,4,4,4,5,1,1,"Phone","","1","",5,5,5,"She was a very kind person who shared many of the same interests as me. The conversation flowed very well and the conversation cards were very helpful. We were able to connect on multiple topics that were shared between us like our family and out academic interests. Overall, it was an enjoyable experience because we seemed to get along. ","s","f24779527_f24189848","fall","f24779527","f24189848",5,7,4.5,5,6.5,6.5,5.5,7,6,5.5,6,4,6.5,5,7,5.5,4.5,5,6.5,7,7.5,5.5,6.5,7,7,6,4.5,5,6,5,5.5,5.5,5,5.5,6,7.5,6.5,6.5,6.5,6.5,6,5,5.5,5.5,5.5,6.5,8.5,4.5,6,6.5,6,6.5,8,5.5,7.5,6,4,7.5,7,7.5
0,"",0,6,5,6,7,3,5,8,8,9,8,7,7,6,5,8,8,7,7,8,7,5,5,5,5,7,6,4,5,5,6,7,6,8,9,3,6,6,6,6,7,6,6,6,7,8,8,5,6,7,8,7,5,4,4,7,8,7,7,8,7,6,8,7,8,4,5,5,5,6,7,7,7,6,8,8,8,6,7,7,8,7,7,5,5,7,6,7,7,6,7,4,3,3,5,5,4,1,2,"","","1","",5,6,4,"The date went well, it felt like we could be good friends. He seemed really sweet and like someone who I would trust for good advice","s","f24189848_f24779527","fall","f24189848","f24779527",5.5,6.5,4,8,8.5,7,5.5,8,7,7.5,5,5,6.5,4.5,5.5,6.5,8.5,4.5,6,6.5,6,6.5,8,5.5,7.5,6,4,7.5,7,7.5,7,7.5,4.5,5,6.5,7,7,8,6.5,7.5,7,5,6.5,7,6.5,5.5,4.5,5,6.5,7,7.5,5.5,6.5,7,7,6,4.5,5,6,5
0,"",0,5,7,5,5,6,5,8,8,8,9,7,7,9,9,5,6,8,7,10,8,7,7,7,6,8,8,8,8,6,6,8,9,8,7,4,4,7,4,7,9,9,8,9,8,8,7,8,8,8,9,6,5,5,3,7,9,8,6,7,7,9,7,9,8,5,5,8,7,10,8,8,8,10,9,8,8,9,8,10,10,8,7,7,6,10,8,8,7,7,7,5,4,5,4,3,4,1,1,"phone number ","","1","",5,5,3,"I was expecting this to go a lot worse than it did. I didn't expect him to actually be a normal attractive guy, but I was very surprised. We got along very well, the conversation flowed easily, was never awkward, and we laughed a ton. He is a junior and I'm a freshmen, but the age gap doesn't really bother me. Overall, nice experience, I would definitely be down to getting to know him more.  ","s","f24319340_f24158421","fall","f24319340","f24158421",6,5,5.5,8,8.5,7,9,5.5,7.5,9,7,6.5,8,8,6,8.5,7.5,4,5.5,8,8.5,8.5,7.5,8,8.5,5.5,4,8,7,7,8,8.5,5,7.5,9,8,9.5,8,8.5,10,7.5,6.5,9,7.5,7,5,7.5,3,7.5,5.5,7,8.5,6,5.5,6,7,4,8,7,6
1,"",0,5,5,6,5,5,5,5,6,7,8,7,7,5,6,7,7,5,5,6,6,8,8,5,4,9,7,5,7,6,6,3,7,7,8,3,3,8,7,4,7,7,7,8,9,6,6,5,6,6,6,6,8,4,4,8,8,7,7,6,6,5,6,6,6,7,7,7,7,7,6,7,7,8,7,8,7,6,7,7,8,8,8,4,5,6,5,7,7,6,6,5,5,5,5,5,5,0,1,"phone number","already did","1","",5,6,3,"The conversation went smoothly from the very beginning with very little awkwardness. We talked an even amount and would answer the same questions we asked each other. Neither of us were expecting to like the date as much as we did. Time went by quickly and I think we both wouldn't have minded if it went longer. We plan to see each other again.","s","f24158421_f24319340","fall","f24158421","f24319340",5,5.5,5,5.5,7.5,7,5.5,7,5,6,8,4.5,8,6,6,5,7.5,3,7.5,5.5,7,8.5,6,5.5,6,7,4,8,7,6,5.5,6,7,7,6.5,7,7.5,7.5,6.5,7.5,8,4.5,5.5,7,6,8.5,7.5,4,5.5,8,8.5,8.5,7.5,8,8.5,5.5,4,8,7,7
1,"",0,5,5,4,4,5,6,6,6,7,6,6,6,6,3,7,6,6,6,5,5,2,3,5,5,6,4,2,3,5,5,6,7,6,6,3,5,7,7,8,8,8,7,8,6,7,7,7,6,5,6,6,5,4,4,5,6,3,5,6,6,6,6,6,6,4,5,7,7,7,7,7,6,7,7,6,6,7,7,6,5,7,7,3,3,4,5,5,5,6,6,2,2,2,3,2,2,0,2,"","I am not really interested in her and we didn't connect that much. My blind date partner is nice and friendly though.","1","",2,2,3,"I felt that she was probably shy and quiet because she is an international student and this is a completely new environment that if overwhelming for her especially given that its her first year here.","r","f24957279_f24518443","fall","f24957279","f24518443",5,4,5.5,6,6.5,6,4.5,6.5,6,5,2.5,5,5,2.5,5,6.5,6,4,7,8,7.5,7,7,6.5,5.5,5.5,4,5.5,4,6,6,6,4.5,7,7,6.5,7,6,7,5.5,7,3,4.5,5,6,5,5,6.5,7.5,7.5,6.5,5,5,6.5,5,5,2.5,7.5,6.5,5
0,"",0,7,7,3,5,7,5,5,7,5,6,7,5,5,5,5,5,7,7,5,5,7,7,5,0,7,7,7,7,7,5,5,5,5,5,5,8,7,8,5,10,5,8,5,5,5,5,8,5,5,5,5,5,0,5,10,5,5,8,5,5,5,8,3,8,7,5,5,10,10,10,7,7,5,10,8,7,7,8,5,10,10,5,5,3,10,8,7,7,7,5,4,1,3,3,2,2,1,2,"","","1","",3,1,2,"I think that we have the different hobby and different ambitions. He is a kind boy. We all from China,so we have the same culture at all. I think that we can not be friends at all. We have different personality.","r","f24518443_f24957279","fall","f24518443","f24957279",7,4,6,6,5.5,6,5,5,7,5,7,2.5,7,7,6,5,5,6.5,7.5,7.5,6.5,5,5,6.5,5,5,2.5,7.5,6.5,5,6.5,5.5,6,7.5,10,7,7.5,7.5,7.5,7.5,7.5,4,9,7,6,6.5,6,4,7,8,7.5,7,7,6.5,5.5,5.5,4,5.5,4,6
1,"",0,5,5,7,6,7,7,7,7,6,7,7,6,6,6,7,5,5,6,5,5,6,7,5,5,5,8,5,7,5,6,7,8,7,9,6,7,3,2,7,8,5,5,4,5,7,8,5,5,6,5,7,6,5,5,5,8,7,9,5,5,7,7,7,7,7,7,5,5,8,7,7,7,6,6,10,7,7,7,8,8,9,9,5,5,6,7,8,8,6,6,3,3,4,3,3,4,1,2,"","","1","",2,2,5,"She was a cutie. Talking with her was nice, she was considerate and made an effort to get to know me. She was moderately attractive to me, I'd say more than the average girl. She seemed well spoken, articulate, and intelligent.","r","f248936_f2435017","fall","f248936","f2435017",5,6.5,7,7,6.5,6.5,6,6,5.5,5,6.5,5,6.5,6,5.5,7.5,8,6.5,2.5,7.5,5,4.5,7.5,5,5.5,6.5,5,6.5,8,5,7,7,7,5,7.5,7,6,8.5,7,8,9,5,6.5,8,6,7.5,7.5,6.5,7,7.5,5,5.5,6,7.5,6,7,3,5,6,6
0,"",0,7,7,6,6,7,6,4,4,7,6,7,7,5,6,7,7,6,6,5,5,7,5,3,3,5,6,5,5,5,6,7,8,7,8,6,7,7,7,7,8,5,5,6,5,6,6,7,8,5,7,7,7,3,3,5,5,6,6,6,6,8,7,8,8,5,5,7,6,6,6,5,6,7,7,8,6,7,8,8,7,7,6,5,5,7,6,7,5,8,7,3,3,3,3,3,2,0,2,"","I think he was a cool guy but I don't see a relationship in the future for us.","1","",5,5,6,"I thought he was a nice guy and a smart person. I didn't feel any romantic connection nor was I super attracted to him. We used the cards a lot but I also tried to steer them into natural conversations.","r","f2435017_f248936","fall","f2435017","f248936",7,6,6.5,4,6.5,7,5.5,7,6,5,6,3,5.5,5,5.5,7.5,7.5,6.5,7,7.5,5,5.5,6,7.5,6,7,3,5,6,6,7.5,8,5,6.5,6,5.5,7,7,7.5,7.5,6.5,5,6.5,6,7.5,7.5,8,6.5,2.5,7.5,5,4.5,7.5,5,5.5,6.5,5,6.5,8,5
0,"",0,6,4,8,8,3,5,8,7,9,5,8,8,8,8,9,8,7,8,8,8,5,5,3,4,7,8,5,5,8,7,7,7,7,8,8,8,8,8,10,9,8,8,9,8,8,7,8,8,8,8,8,8,8,6,5,6,6,6,8,8,8,8,8,9,5,8,8,8,8,7,8,7,8,8,8,8,9,8,8,8,7,5,7,6,8,5,7,7,8,8,4,3,2,6,5,6,0,2,"","I chose not to exchange contact information with my blind date partner because he is a little bit younger than me and although we got along well, it felt more platonic than romantic to me. ","1","",5,4,2,"I thought the date was fine, we talked about basic facts about ourselves. He seems like a very nice, driven, and knowledgeable person, but I just don;t think we have much in common. Since he is a freshman too, there is a lot of new things happening for him, so it seems like we're just at very different stages in life. I enjoyed talking to him, but I would rather be friends.","r","f24438165_f24936438","fall","f24438165","f24936438",5,8,4,7.5,7,8,8,8.5,7.5,8,5,3.5,7.5,5,7.5,7,7.5,8,8,9.5,8,8.5,7.5,8,8,8,7,5.5,6,8,8,8.5,6.5,8,7.5,7.5,8,8,8.5,8,6,6.5,6.5,7,8,7.5,9.5,6,8,7.5,8,7.5,8,9,5.5,7,5,6.5,7,7.5
1,"",0,5,8,6,6,7,5,6,5,8,7,5,7,6,6,6,6,7,6,6,6,7,6,5,5,5,5,5,5,5,5,7,8,10,9,5,7,8,8,7,8,8,8,8,7,8,8,9,9,6,5,7,7,7,3,5,8,6,8,8,7,8,8,9,8,7,8,8,8,8,8,8,8,7,8,6,8,8,8,8,8,8,8,5,3,5,7,8,9,7,6,4,4,4,3,3,4,1,2,"","","1","",6,5,2,"we talked about 1 card about long term relationship.
athletic date, driven.
I wouldn't mind a second date
the date was fun, we talked a lot about ourselves. ","r","f24936438_f24438165","fall","f24936438","f24438165",6.5,6,6,5.5,7.5,6,6,6,6.5,6,6.5,5,5,5,5,7.5,9.5,6,8,7.5,8,7.5,8,9,5.5,7,5,6.5,7,7.5,8,8.5,7.5,8,8,8,7.5,7,8,8,8,4,6,8.5,6.5,7,7.5,8,8,9.5,8,8.5,7.5,8,8,8,7,5.5,6,8
1,"",0,6,6,8,7,8,8,8,8,8,8,8,7,7,8,7,8,7,8,8,6,6,6,5,5,8,7,5,5,8,8,5,5,6,5,4,4,6,6,8,8,6,5,8,7,7,7,6,6,7,7,6,5,6,5,6,7,6,7,6,7,6,7,7,7,7,6,7,7,8,7,7,7,7,8,6,6,8,8,6,7,8,9,5,5,8,8,7,6,7,7,4,4,4,1,1,1,1,2,"","","1","",6,6,7,"Very compatible in almost all topics. Had a good conversation that flowed very easily and comfortably. Did not feel like it was our first time meeting, skipped over the awkward stage fairly quickly.","r","f24169226_f24602929","fall","f24169226","f24602929",6,7.5,8,8,8,7.5,7.5,7.5,7.5,7,6,5,7.5,5,8,5,5.5,4,6,8,5.5,7.5,7,6,7,5.5,5.5,6.5,6.5,6.5,6.5,7,6.5,7,7.5,7,7.5,6,8,6.5,8.5,5,8,6.5,7,5.5,5,5.5,6.5,6,6.5,5.5,6,7,5,5.5,3,6,5,6
0,"",1,4,3,5,5,3,4,5,5,7,7,5,4,6,6,4,5,6,5,6,6,6,5,5,5,7,5,5,5,6,5,6,5,5,5,6,5,7,6,6,6,6,7,6,5,6,6,7,7,5,5,6,5,3,3,6,6,5,5,6,6,6,5,5,5,5,5,6,6,6,6,6,6,6,6,6,6,6,7,6,6,5,5,4,4,5,5,5,5,6,6,4,2,3,4,3,4,1,2,"","","1","",3,6,6,"I thought the date went well. We definitely have similar values and outlooks on life. We got along well and are both friendly and kind. It was hard to answer the questions about sexual stuff/religion as we didn't talk about that stuff. Overall, I am not sure there was a romantic connection but we did have similar values and got along nicely. ","r","f24602929_f24169226","fall","f24602929","f24169226",3.5,5,3.5,5,7,4.5,6,4.5,5.5,6,5.5,5,6,5,5.5,5.5,5,5.5,6.5,6,6.5,5.5,6,7,5,5.5,3,6,5,6,5.5,5,5,6,6,6,6,6,6.5,6,5,4,5,5,6,5,5.5,4,6,8,5.5,7.5,7,6,7,5.5,5.5,6.5,6.5,6.5
1,"",1,6,7,7,7,7,6,7,7,7,6,7,7,7,7,7,7,7,7,7,7,7,7,7,7,7,6,6,7,7,7,6,6,8,8,3,5,4,4,4,7,8,8,7,7,9,7,7,7,4,8,7,7,7,4,8,7,8,8,8,7,7,6,7,5,5,6,5,5,6,6,5,7,7,5,7,7,6,6,5,7,7,7,5,5,7,7,5,6,5,7,1,4,4,1,1,4,0,2,"","I think she's cool just not my type and a little younger. ","1","",3,2,1,"I think it went good, she's a very nice girl. I think sometimes based on age there's not a whole lot to talk about because it's a big gap. I think the perspective on different things as an upper division undergraduate vs a lower division undergraduate is very different. I feel like the question cards could have been more helpful, and that some of the questions are a little too direct for a casual first conversation. ","r","f2464768_f24154830","fall","f2464768","f24154830",6.5,7,6.5,7,6.5,7,7,7,7,7,7,7,6.5,6.5,7,6,8,4,4,5.5,8,7,8,7,6,7,5.5,7.5,8,7.5,6.5,6,5.5,5,6,6,6,7,6,6,7,5,7,5.5,6,6,7,7,6.5,6,5.5,6,6.5,6.5,5.5,5.5,5,7,5,7
0,"",0,3,4,5,5,4,4,6,6,5,5,5,5,5,4,5,6,4,2,5,4,5,4,5,6,5,4,5,5,5,5,7,5,7,7,6,8,6,7,6,6,6,5,7,5,7,6,7,6,6,5,6,5,5,5,7,7,5,5,7,7,6,5,7,7,6,6,6,6,5,7,7,6,7,6,7,7,7,7,7,7,7,5,5,5,8,6,5,5,6,5,1,1,2,2,2,3,0,2,"","Not interested in them romantically. ","1","",3,3,1,"I thought the date went well, however I didn't have any romantic attraction to my partner. But it was easy to carry on a conversation and I didn't feel super awkward at all. I didn't have many expectations for the date, so I can't say I was disapointed either. I like how we had free range to choose where and what we wanted to do during the 30 minutes. ","r","f24154830_f2464768","fall","f24154830","f2464768",3.5,5,4,6,5,5,4.5,5.5,3,4.5,4.5,5.5,4.5,5,5,6,7,7,6.5,6,5.5,6,6.5,6.5,5.5,5.5,5,7,5,7,5.5,7,6,6,6,6.5,6.5,7,7,7,6,5,7,5,5.5,6,8,4,4,5.5,8,7,8,7,6,7,5.5,7.5,8,7.5
1,"",0,4,3,4,4,5,5,4,4,3,4,3,4,4,3,5,5,4,5,5,5,3,3,5,5,4,5,3,4,3,3,6,6,5,6,6,5,5,9,6,6,6,6,8,8,6,7,6,6,3,3,7,6,5,3,9,6,5,4,7,7,9,6,7,7,8,9,8,9,5,6,7,7,9,8,7,6,8,6,5,5,9,8,6,5,6,8,9,8,7,7,1,1,1,1,2,2,0,2,"","There just was not a spark","1","",2,3,1,"The date was mostly made up of small talk. My partner and I got along well, but I don't find her attractive or desire a romantic connection with her. While I think she is a nice person, I feel like she was just participating in the date for the research credit. I thought the length of the date was too long for the substance of conversation we had.","r","f24375631_f24976386","fall","f24375631","f24976386",3.5,4,5,4,3.5,3.5,3.5,5,4.5,5,3,5,4.5,3.5,3,6,5.5,5.5,7,6,6,8,6.5,6,3,6.5,4,7.5,4.5,7,7.5,7,8.5,8.5,5.5,7,8.5,6.5,7,5,8.5,5.5,7,8.5,7,6.5,8,9,7,4.5,5.5,7.5,6,7,5.5,6.5,0.5,5.5,5.5,6
0,"",1,6,5,5,4,4,5,6,7,5,6,5,5,6,7,6,6,6,6,6,5,5,4,0,2,7,6,5,6,6,6,7,6,8,8,9,9,7,7,4,5,5,6,8,7,6,6,7,7,4,7,7,6,1,0,6,5,6,5,6,6,7,6,7,7,7,7,7,7,5,6,6,6,7,7,7,7,7,7,4,5,7,6,4,4,7,7,6,6,6,6,3,3,3,4,3,4,0,2,"","I think we got along well! And I would like to ask for her Instagram before she leaves...but I got friendly vibes more than romantic, and exchanging a phone number feels a little more intimate to me.","1","",5,3,1,"I enjoyed getting to know her! We got along well, and we talked about school, where we're living, majors, work, and hobbies. I did feel a bit like I should've asked her more about herself, and she asked me a lot of follow up questions about myself. Things didn't feel awkward or uncomfortable, but overall, I think we would've been better as friends. ","r","f24976386_f24375631","fall","f24976386","f24375631",5.5,4.5,4.5,6.5,5.5,5,6.5,6,6,5.5,4.5,1,6.5,5.5,6,6.5,8,9,7,4.5,5.5,7.5,6,7,5.5,6.5,0.5,5.5,5.5,6,6.5,7,7,7,5.5,6,7,7,7,4.5,6.5,4,7,6,6,6,5.5,5.5,7,6,6,8,6.5,6,3,6.5,4,7.5,4.5,7
1,"",0,6,6,5,3,10,9,6,6,8,7,5,5,8,5,7,7,7,7,8,7,4,3,0,0,6,7,5,5,5,4,6,5,9,9,4,4,7,7,7,8,7,7,7,6,8,8,5,6,7,7,9,9,7,5,8,8,6,7,7,7,8,5,6,6,5,5,7,6,7,7,7,6,7,5,7,7,8,8,9,8,9,9,8,8,5,5,7,7,8,6,1,1,1,3,3,3,0,2,"","didn't click ","7","seen them around",2,2,6,"Had very different opinions and strengths but overall she was fun and cool ","s","f24102573_f24473873","fall","f24102573","f24473873",6,4,9.5,6,7.5,5,6.5,7,7,7.5,3.5,0,6.5,5,4.5,5.5,9,4,7,7.5,7,6.5,8,5.5,7,9,6,8,6.5,7,6.5,6,5,6.5,7,6.5,6,7,8,8.5,9,8,5,7,7,6.5,7.5,8,6.5,7.5,5,8,7,5.5,5,3.5,0,4,4.5,5.5
0,"",0,5,5,5,6,7,3,7,7,6,7,5,3,7,6,6,6,5,4,6,6,7,7,6,6,4,6,6,6,6,5,7,6,7,8,8,8,7,6,7,8,5,5,8,8,8,6,6,5,4,6,3,4,0,0,3,5,4,5,6,5,7,6,6,6,5,6,6,6,7,5,5,5,8,7,7,6,7,6,6,6,7,6,2,0,6,5,6,5,7,7,5,6,5,4,4,5,1,2,"","","5","",3,5,6,"I thought it went well - we conversed very easily the whole time and got along. I knew him already through other people and honestly in a little bit of a negative sense, but we got along better than I thought based on that. The cards were very helpful and it did not feel awkward, which I normally would have been worried about. I think as people we are relatively different so long term maybe wouldn't work out great, but on a basic level get along pretty well. I'm pretty sure he is more religious and probably more conservative than me, and our interests and majors are very different, but basically we are compatible.","s","f24473873_f24102573","fall","f24473873","f24102573",5,5.5,5,7,6.5,4,6.5,6,4.5,6,7,6,5,6,5.5,6.5,7.5,8,6.5,7.5,5,8,7,5.5,5,3.5,0,4,4.5,5.5,6.5,6,5.5,6,6,5,7.5,6.5,6.5,6,6.5,1,5.5,5.5,7,5.5,9,4,7,7.5,7,6.5,8,5.5,7,9,6,8,6.5,7
